/*!40101 SET NAMES binary*/;
/*!40014 SET FOREIGN_KEY_CHECKS=0*/;
/*!40103 SET TIME_ZONE='+00:00' */;
INSERT INTO `tree` VALUES
(1,"fr",0,8,4,0,"Accueil","","","","Accueil","Unilend : les particuliers prêtent aux entreprises françaises","Sur Unilend, tout le monde peut prêter aux entreprises françaises et recevoir des intérêts.","Financement entreprise, prêt à des entreprises, investissement direct, peer-to-peer lending, crowdfunding",0,1,1,0,1,"2011-10-27 17:20:49","2014-02-19 13:02:04","2011-10-27 17:20:49"),
(2,"fr",1,0,4,0,"Prêter","preteurs","","","Prêter","Inscription prêteurs","Prêtez votre argent à des entreprises françaises et recevez chaque mois des intérêts.","investissement, épargne, prêt rémunéré en direct, prêter, ",0,1,1,0,1,"2013-06-28 16:15:02","2014-02-11 16:34:51","0000-00-00 00:00:00"),
(3,"fr",1,0,4,0,"Emprunter","emprunteurs","","","Emprunter","Emprunteurs","Emprunter directement auprès du grand public","financement d\'entreprises, prêt pme, emprunter, prêt entreprise",1,1,1,0,1,"2013-06-28 16:15:35","2014-02-11 16:07:30","0000-00-00 00:00:00"),
(4,"fr",1,14,4,0,"Projets à financer","projets-a-financer","","","Projets","Projets en cours","Découvrez les projets qui recherche un prêt  sur Unilend.","projets à financer, prêt aux entreprise, crowdfunding, finance d\'entreprise",3,1,1,0,1,"2013-06-28 16:15:56","2014-02-11 17:10:55","0000-00-00 00:00:00"),
(5,"fr",1,0,4,0,"Unilend","unilend-fr-5","","","Unilend","Unilend","Découvrez l\'équipe Unilend","présentation, Qui sommes-nous, équipe, contact, recrutement ",4,1,0,0,1,"2013-06-28 16:16:08","2014-02-11 17:18:14","0000-00-00 00:00:00"),
(7,"fr",5,2,13,0,"Qui sommes-nous","qui-sommes-nous","","","Qui sommes-nous","Qui sommes-nous","Unilend réunit une équipe chevronnée et des partenaires de premier plan.","Equipe, Nicolas Lesur, François Prioux, Pierre-Henri Cassou, agent prestataire de services de paiement ",0,1,1,0,1,"2013-07-01 10:15:30","2015-06-09 18:20:55","0000-00-00 00:00:00"),
(10,"fr",1,1,1,0,"Comment ça marche","comment-ca-marche","","","Fonctionnement","Découvrez Unilend en vidéo","Unilend expliqué en images et en 1minutes 15\r\n","vidéo, comment ça marche, fonctionnement, ",2,1,1,0,1,"2013-07-01 10:28:20","2015-06-19 11:44:36","0000-00-00 00:00:00"),
(11,"fr",1,5,3,0,"Plan du site","plan-du-site","","","Plan du site","Plan du site","Plan du site","",7,1,0,0,1,"2013-07-01 10:28:55","2013-11-11 18:09:48","0000-00-00 00:00:00"),
(16,"fr",127,1,18,0,"Validation inscription par virement","validation-inscription-par-virement","","","Validation inscription par virement","Inscription en cours d\'activation","Inscription en cours d\'activation : une fois les pièces vérifiées, vous pourrez prêter de l\'argent à des entreprises et recevoir des intérêts.","Virement , carte bleue, alimenter compte, finir  inscription, terminer inscription",0,1,1,0,1,"2013-07-01 11:37:47","2014-08-08 12:46:36","0000-00-00 00:00:00"),
(20,"fr",1,0,1,1,"Compte prêteur","compte-preteur","","","Compte prêteur","Compte prêteur","Compte prêteur","",5,1,0,0,1,"2013-07-02 11:08:23","2013-07-02 11:08:23","0000-00-00 00:00:00"),
(21,"fr",1,0,1,2,"Compte emprunteur","compte-emprunteur","","","Compte emprunteur","Compte emprunteur","Compte emprunteur","",6,1,0,0,1,"2013-07-02 11:08:38","2013-10-18 09:50:25","0000-00-00 00:00:00"),
(47,"fr",5,4,4,0,"Nous contacter","contact","","","Nous contacter","Contact","Si vous avez une question, prenez contact avec nous et nous vous répondrons rapidement.","contact, contacter, remarques, questions, problèmes",3,1,1,0,1,"2013-07-02 15:12:52","2014-10-10 16:25:20","0000-00-00 00:00:00"),
(48,"fr",128,1,4,0,"Confirmation de dépôt de dossier","confirmation-depot-de-dossier","","","Confirmation dépôt de dossier","Confirmation dépôt de dossier","Confirmation dépôt de dossier","projet à l\'étude, dépôt de dossier terminé, ",1,1,0,0,1,"2013-07-16 11:49:13","2014-02-11 16:18:56","0000-00-00 00:00:00"),
(49,"fr",7,7,4,0,"François Prioux","francois-prioux","","","François Prioux","François Prioux","François Prioux","",2,1,1,0,1,"2013-07-23 14:32:25","2014-08-25 19:09:29","0000-00-00 00:00:00"),
(51,"fr",7,7,26,0,"Nicolas Lesur","nicolas-lesur","","","Nicolas Lesur","Nicolas Lesur","Nicolas Lesur","",1,1,1,0,1,"2013-07-23 15:37:49","2015-04-30 10:59:33","0000-00-00 00:00:00"),
(52,"fr",7,7,4,0,"Matthieu Trouvat","matthieu-trouvat","","","Matthieu Trouvat","Matthieu Trouvat","Matthieu Trouvat","Matthieu Trouvat",12,1,1,0,1,"2013-07-23 15:39:26","2014-04-24 19:24:35","0000-00-00 00:00:00"),
(53,"fr",2,1,4,0,"Prêter à des entreprises françaises","les-avantages-dunilend-pour-les-preteurs","","","Pourquoi prêter","Prêter à des entreprises françaises","Unilend permet de prêter aux entreprises françaises et de recevoir des intérêts, chaque mois.","prêt en direct, investissement, épargne, soutien pme, finance participative",0,1,1,0,1,"2013-08-12 14:25:40","2015-04-01 09:13:01","0000-00-00 00:00:00"),
(54,"fr",3,1,26,0,"Emprunter auprès du grand public","les-avantages-dun-emprunt-sur-unilend","","","Emprunter facilement","Emprunter facilement","Unilend permet aux TPE et PME d\'emprunter de l\'argent directement auprès du grand public pour financer leurs projets.","emprunt, prêt entreprise, finance d\'entreprise, emprunter auprès du public, crowdfunding",0,1,1,0,1,"2013-08-12 14:36:02","2015-07-08 15:27:13","0000-00-00 00:00:00"),
(55,"fr",10,1,4,0,"Les règles d\'Unilend","les-regles-dunilend","","","Les règles d\'Unilend","Les règles d\'Unilend","Découvrez les règles que tout le monde respecte sur d\'Unilend ","règle, fonctionnement, réglementation, code, ",4,1,1,0,1,"2013-08-12 16:35:46","2015-07-16 14:25:05","0000-00-00 00:00:00"),
(69,"fr",7,7,3,0,"Martin Comar","martin-comar","","","Martin Comar","Martin Comar","Martin Comar","",20,1,1,0,1,"2013-09-02 09:31:18","2014-08-25 18:23:15","0000-00-00 00:00:00"),
(70,"fr",7,7,3,0,"Louis Prunel","louis-prunel","","","Louis Prunel","Louis Prunel","Louis Prunel","",21,1,1,0,1,"2013-09-02 09:40:03","2014-08-25 18:23:24","0000-00-00 00:00:00"),
(80,"fr",7,7,3,0,"Claude Rousset","claude-rousset","","","Claude Rousset","Claude Rousset","Claude Rousset","",8,1,1,0,1,"2013-09-02 15:30:42","2015-04-20 12:37:15","0000-00-00 00:00:00"),
(81,"fr",7,7,3,0,"Arnaud Poissonnier","arnaud-poissonnier","","","Arnaud Poissonnier","Arnaud Poissonnier","Arnaud Poissonnier","",9,1,1,0,1,"2013-09-02 15:31:02","2015-04-20 12:37:34","0000-00-00 00:00:00"),
(82,"fr",7,7,3,0,"Pierre-Henri Cassou","pierre-henri-cassou","","","Pierre-Henri Cassou","Pierre-Henri Cassous","Pierre-Henri Cassous","",7,1,1,0,1,"2013-09-02 15:31:39","2015-04-20 12:37:23","0000-00-00 00:00:00"),
(89,"fr",127,1,27,0,"Conditions générales d\'utilisation","cgu","","","Conditions générales d\'utilisation","CGU","CGU","Conditions générales de vente, cgv, informations, SFFPME, responsabilités",2,1,1,0,1,"2013-09-04 17:17:01","2015-07-10 10:10:17","0000-00-00 00:00:00"),
(90,"fr",10,1,18,0,"Guide de l\'emprunteur","le-guide-de-lemprunteur-fr-90","","","Guide de l\'emprunteur","Guide de l\'emprunteur","Unilend permet aux TPE et PME d\'emprunter de l\'argent directement auprès du grand public pour financer leurs projets. Prenez connaissances de ces quelques conseils ","guide emprunteur, présenter un projet, déroulement d\'une campagne de financement, processus",2,1,1,0,1,"2013-09-09 11:41:17","2015-02-27 18:30:17","0000-00-00 00:00:00"),
(91,"fr",10,1,4,0,"Guide du prêteur","guide-du-preteur","","","Guide du prêteur","Guide du prêteur","Unilend permet de prêter aux entreprises françaises et de recevoir des intérêts, chaque mois. Prenez connaissance de ces quelques conseils pour bien prêter.","guide prêteur, choisir les entreprises, choisir le taux, répartir ses investissements, bonnes pratiques",1,1,1,0,1,"2013-09-09 17:43:15","2015-03-05 19:02:42","0000-00-00 00:00:00"),
(92,"fr",89,9,27,0,"Conditions Générales de Vente Prêteurs personnes physiques","cgu-preteur-individual-1","","","Conditions générales de vente prêteurs personnes physiques 12/11/2013","Conditions générales de vente prêteur personne physique","Conditions générales de vente prêteur personne physique","Conditions générales de vente prêteurs personnes physiques, cgv prêteurs personnes physiques, informations prêt, SFFPME, responsabilités",0,0,0,0,1,"2013-09-12 16:56:23","2015-07-10 19:36:37","0000-00-00 00:00:00"),
(93,"fr",89,9,27,0,"Conditions générales de vente prêteur personne morale","cgu-preteur-societe-1","","","Conditions générales de vente prêteur personne morale 12/11/2013","Conditions générales de vente prêteur personne morale","Conditions générales de vente prêteur personne morale","Conditions générales de vente prêteurs personnes physiques, cgv prêteurs personnes physiques, informations prêt, SFFPME, responsabilités",1,0,0,0,1,"2013-09-12 16:56:58","2015-07-10 19:36:32","0000-00-00 00:00:00"),
(94,"fr",128,1,4,0,"Conditions générales d\'utilisation","cgu-fr-94","","","CGU bénéficiaire","CGU","CGU","Condition générales d\'utilisation, CGU, responsabilités, informations",2,1,1,0,1,"2013-09-12 16:57:58","2014-02-11 16:21:34","0000-00-00 00:00:00"),
(95,"fr",94,9,27,0,"Conditions générales de vente bénéficiaire","cgv-1-depot-de-dossier","","","CGV bénéficiaire 12/11/2013","Conditions générales de vente bénéficiaire","Conditions générales de vente bénéficiaire","conditions générales de vente bénéficiaires, cgv bénéficiaires",1,0,0,0,0,"2013-09-12 16:58:37","2015-07-10 19:38:02","0000-00-00 00:00:00"),
(97,"fr",90,1,26,0,"Comment rendre sa campagne attractive","comment-rendre-sa-campagne-attractive","","","Comment rendre sa campagne attractive","Comment rendre sa campagne attractive","Comment rendre sa campagne attractive sur Unilend.","bonnes pratiques, techniques, méthodes, aides,  ",6,1,1,0,1,"2013-09-16 13:45:47","2015-06-19 10:54:50","0000-00-00 00:00:00"),
(98,"fr",10,2,3,0,"Fiscalité","fiscalite","","","Fiscalité","Fiscalité","Prenez connaissance du régime fiscal des intérêts perçu sur Unilend.","fiscalité, impôts, imposition, déclaration fiscale, retenue à la source",5,1,1,0,1,"2013-09-19 14:45:26","2015-01-13 11:44:33","0000-00-00 00:00:00"),
(99,"fr",10,1,4,0,"Questions fréquentes","questions-frequentes","","","Questions fréquentes","FAQ","Vous avez une question sur Unilend ? Nous y répondons.","questions, réponses, foires aux questions, frequently asked questions, ",3,1,1,0,1,"2013-09-25 09:34:28","2015-06-29 13:46:21","0000-00-00 00:00:00"),
(100,"fr",1,1,13,0,"Informations légales","infos-legales","","","Informations légales","Informations légales","Unilend est édité par la Société française pour le financement des PME - SAS.","",8,1,0,0,1,"2013-09-26 08:17:32","2015-06-15 17:33:31","0000-00-00 00:00:00"),
(101,"fr",10,2,4,0,"La presse en parle","la-presse-en-parle","","","La presse en parle","La presse en parle","La presse en parle","presse, Interviews, article, journaux, media",8,1,1,0,1,"2013-09-26 08:52:51","2015-04-16 11:45:38","0000-00-00 00:00:00"),
(102,"fr",101,7,26,0,"BFM Business 17 juillet 2013","bfm-business","","","BFM Business 17 juillet 2013","La presse en parle","La presse en parle","",115,1,1,0,1,"2013-09-26 09:20:04","2015-04-17 15:52:21","0000-00-00 00:00:00"),
(103,"fr",101,7,26,0,"L\'Express 16 septembre 2013","lexpress","","","L\'Express 16 septembre 2013","aa","La presse en parle","",114,1,1,0,1,"2013-09-26 11:56:37","2015-04-17 15:51:55","0000-00-00 00:00:00"),
(104,"fr",101,7,26,0,"Chef d\'entreprise 26 septembre 2013","chef-dentreprise","","","Chef d\'entreprise 26 septembre 2013","Chef d\'entreprise","Chef d\'entreprise","",113,1,1,0,1,"2013-09-26 12:45:37","2015-04-17 15:51:26","0000-00-00 00:00:00"),
(105,"fr",7,7,4,0,"Les partenaires","partenaires","","","Les partenaires","Nos partenaires","Nos partenaires","",26,1,1,0,1,"2013-10-01 10:09:01","2015-04-17 19:39:33","0000-00-00 00:00:00"),
(106,"fr",7,7,3,0,"Altares","altares","","","Altares","Altares","Altares","",31,1,1,0,1,"2013-10-01 10:10:50","2013-11-11 17:30:25","0000-00-00 00:00:00"),
(107,"fr",7,7,1,0,"Ladislas de La Morinerie","ladislas-de-la-morinerie","","","Ladislas de La Morinerie","Ladislas de La Morinerie","Ladislas de La Morinerie","",16,1,1,0,1,"2013-10-01 17:55:15","2013-12-27 12:04:10","0000-00-00 00:00:00"),
(108,"fr",7,7,4,0,"SFPMEI","sfpmei","","","SFPMEI","SFPMEI","SFPMEI","",30,1,1,0,1,"2013-10-01 17:57:54","2015-04-17 20:05:41","0000-00-00 00:00:00"),
(110,"fr",7,7,4,0,"Olivier Pineda","olivier-pineda-fr-110","","","Olivier Pineda","Olivier Pineda","Olivier Pineda","",24,1,1,0,1,"2013-10-02 10:05:59","2015-04-17 16:22:36","0000-00-00 00:00:00"),
(111,"fr",7,7,4,0,"Isabelle Cabre-Hamache","isabelle-cabre-hamache-fr-111","","","Isabelle Cabre-Hamache","Isabelle Cabre-Hamache","Isabelle Cabre-Hamache","",22,1,1,0,1,"2013-10-02 10:23:17","2015-04-17 16:21:18","0000-00-00 00:00:00"),
(112,"fr",7,7,4,0,"Gaëlle Pineda","gaelle-pineda-fr-112","","","Gaëlle Pineda","Gaëlle Pineda","Gaëlle Pineda","",25,1,1,0,1,"2013-10-02 10:23:42","2015-04-17 16:21:38","0000-00-00 00:00:00"),
(114,"fr",7,7,4,0,"Séverine Farge","severine-farge-fr-114","","","Séverine Farge","Séverine Farge","Séverine Farge","",23,1,1,0,1,"2013-10-02 12:40:40","2015-04-17 20:03:14","0000-00-00 00:00:00"),
(118,"fr",21,10,3,2,"Etape de transition","etape-de-transition","","","Etape de transition","Etape de transition","Etape de transition","",1,1,1,0,1,"2013-10-18 09:49:04","2013-11-16 13:57:26","0000-00-00 00:00:00"),
(119,"fr",1,12,4,0,"Nouveau mot de passe","nouveau-mot-de-passe","","","Nouveau mot de passe","Nouveau mot de passe","Demandez un nouveau mot de passe","mot de passe, ",9,1,0,0,1,"2013-10-24 10:29:57","2014-02-11 17:26:36","0000-00-00 00:00:00"),
(120,"fr",120,1,1,0,"Conditions générales d\'utilisation","-fr-120","","","Conditions générales d\'utilisation","Conditions générales d\'utilisation","Conditions générales d\'utilisation","",11,0,1,0,1,"2013-10-28 10:47:21","2014-04-30 14:31:48","0000-00-00 00:00:00"),
(121,"fr",1,1,26,0,"Conditions générales d\'utilisation","conditions-generales-dutilisation","","","Conditions générales d\'utilisation","Conditions générales d\'utilisation","Conditions générales d\'utilisation d\'Unilend.","",10,1,0,0,1,"2013-10-28 11:15:24","2015-06-19 10:50:43","0000-00-00 00:00:00"),
(122,"fr",90,1,4,0,"Documents à fournir par les emprunteurs","documents-a-fournir-par-les-emprunteurs","","","Documents à fournir par les emprunteurs","Documents à fournir pour les emprunteurs","Voici la liste des documents à fournir pour  emprunter avec Unilend","documents, documents à fournir, documents nécessaire, ",1,1,1,0,1,"2013-10-29 10:12:32","2014-09-09 18:47:10","0000-00-00 00:00:00"),
(123,"fr",5,1,4,0,"Recrutement","recrutement","","","Recrutement","Recrutement","Vous voulez rejoindre une entreprise de croissance tournée vers l\'innovation financière ? Ecrivez-nous.","jobs, rh, profile, recruter, talents,",2,1,1,0,1,"2013-10-29 10:16:49","2015-07-24 17:50:58","0000-00-00 00:00:00"),
(124,"fr",101,7,26,0,"Le Monde 21 octobre 2013","le-monde-21102013","","","Le Monde 21 octobre 2013","Le Monde 21/10/2013","Le Monde 21/10/2013","",111,1,0,0,1,"2013-11-05 11:48:35","2015-04-17 15:50:59","0000-00-00 00:00:00"),
(125,"fr",101,7,26,0,"Mieux Vivre Votre Argent octobre 2013","mieux-vivre-votre-argent-novembre-2013","","","Mieux Vivre Votre Argent octobre 2013","Mieux Vivre Votre Argent novembre 2013","Mieux Vivre Votre Argent novembre 2013","",112,1,1,0,1,"2013-11-05 11:49:30","2015-04-17 15:52:34","0000-00-00 00:00:00"),
(127,"fr",2,0,4,0,"Ouvrir un compte","inscription-preteurs","","","Ouvrir un compte","Inscription prêteurs","Ouvrir un compte pour prêter aux entreprises françaises.","inscription prêteur, ouverture de compte, devenir membre, devenir prêteur, commencer à prêter",2,1,1,0,1,"2013-11-07 11:29:12","2014-02-11 16:16:55","0000-00-00 00:00:00"),
(128,"fr",3,0,4,0,"Présenter un projet","depot-de-dossier","","","Présenter un projet","Dépot de dossier","Présenter un projet pour emprunter auprès du grand public.","déposer un dossier, déposer un projet, déposer une demande d\'emprunt, inscription emprunteur, soumettre un projet",1,1,1,0,1,"2013-11-07 11:33:30","2014-02-11 16:14:29","0000-00-00 00:00:00"),
(129,"fr",10,1,4,0,"Découvrez Unilend en images","decouvrez-unilend-en-images","","","Découvrez Unilend en images","comment ça marche","Découvrez Unilend en vidéo (durée : 1\'15)","vidéo, comment ça marche, fonctionnement, ",0,1,1,0,1,"2013-11-07 14:11:10","2014-11-14 11:11:56","0000-00-00 00:00:00"),
(130,"fr",127,1,18,0,"Inscription en cours de vérification","validation-inscription","","","Validation inscription","Inscription en cours d\'activation","Inscription en cours d\'activation : une fois les pièces vérifiées, vous pourrez prêter de l\'argent à des entreprises et recevoir des intérêts.","Virement , virement compte bancaire, alimenter compte, finir  inscription, terminer inscription, ",1,1,1,0,1,"2013-11-08 15:36:09","2014-08-08 12:52:01","0000-00-00 00:00:00"),
(132,"fr",101,7,26,0,"Capital.fr 13 novembre 2013","capital.fr","","","Capital.fr 13 novembre 2013","Capital.fr","Capital.fr","",110,1,1,0,1,"2013-11-13 11:57:24","2015-04-17 15:49:55","0000-00-00 00:00:00"),
(134,"fr",101,7,26,0,"Les Echos Patrimoine 20 novembre 2013","les-echos-patrimoines","","","Les Echos Patrimoine 20 novembre 2013","Les Echos Patrimoine","Les Echos Patrimoine","",109,0,0,1,0,"2013-11-20 19:43:30","2015-07-22 14:27:03","0000-00-00 00:00:00"),
(135,"fr",10,1,18,0,"Sécurité","securite","","","Sécurité","Sécurité","Découvrez ces quelques conseils pour naviguer en toute sécurité sur Unilend","mot de passe, connection, verisign, payline, https",10,1,0,0,1,"2013-11-21 18:40:01","2015-03-05 14:43:25","0000-00-00 00:00:00"),
(136,"fr",101,7,26,0,"L\'AGEFI quotidien 22 novembre 2013","lagefi-quotidien","","","L\'AGEFI quotidien 22 novembre 2013","L\'AGEFI quotidien","L\'AGEFI quotidien","",108,1,1,0,1,"2013-11-22 20:01:59","2015-04-17 15:48:47","0000-00-00 00:00:00"),
(138,"fr",20,1,3,1,"Ajouter de l\'argent par virement","validation-virement","","","Validation virement","Validation de votre virement","Validation virement","",1,1,1,0,1,"2013-11-26 15:09:56","2013-12-26 15:06:36","0000-00-00 00:00:00"),
(139,"fr",20,1,3,1,"Paiement par carte bancaire","validation-cb","","","Validation cb","Validation cb","Validation cb","",2,1,1,0,1,"2013-11-26 15:10:48","2013-12-26 15:10:57","0000-00-00 00:00:00"),
(140,"fr",20,1,3,1,"Ajouter de l\'argent par prélèvement","validation-prelevement","","","Validation prélèvement","Validation prélèvement","Validation prélèvement","",3,1,1,0,1,"2013-11-26 15:11:35","2013-11-26 17:35:10","0000-00-00 00:00:00"),
(141,"fr",91,2,4,0,"Comprendre la note Unilend","comprendre-la-note-unilend","","","Comprendre la note Unilend","Comment sont notés les emprunteurs ?","Comprendre la note Unilend. Seuls les projets les plus solides sont présentés aux prêteurs.","note unilend, sélection des projets, comité d\'analyse des risques, critères, étoiles Unilend ",1,1,0,0,1,"2013-11-26 19:25:06","2015-07-16 17:31:01","0000-00-00 00:00:00"),
(142,"fr",47,0,4,0,"Les garanties Unilend","les-garanties-unilend","","","Les garanties Unilend","Les garanties Unilend","Les garanties Unilend","",1,1,1,0,1,"2013-12-03 18:37:15","2013-12-03 18:37:18","0000-00-00 00:00:00"),
(144,"fr",101,7,26,0,"Business Angel France 15 décembre 2013","-fr-144","","","Business Angel France 15 décembre 2013","Business Angel France","Business Angel France","",107,1,0,0,1,"2013-12-16 17:40:17","2015-04-17 15:48:13","0000-00-00 00:00:00"),
(145,"fr",101,7,26,0,"BFM Business 8 janvier 2014","bfm-business-08012014","","","BFM Business 8 janvier 2014","BFM Business 08/01/2014","BFM Business 08/01/2014","",106,1,1,0,1,"2014-01-08 09:44:51","2015-04-17 15:47:42","0000-00-00 00:00:00"),
(147,"fr",101,7,26,0,"Capital 30 janvier 2014","capital-30-01-14","","","Capital 30 janvier 2014","Capital - ils ont eu la bonne idée","Capital - ils ont eu la bonne idée","",104,1,1,0,1,"2014-01-31 17:14:37","2015-04-17 15:46:10","0000-00-00 00:00:00"),
(148,"fr",101,7,26,0,"BFM TV 13 février 2014","bfm-tv-13022014","","","BFM TV 13 février 2014","BFM TV","BFM TV","Nicolas Doze, crowdfunding, BFM TV, Financement d\'entreprises en direct, finance participative",103,1,1,0,1,"2014-02-14 11:27:29","2015-04-17 15:45:22","0000-00-00 00:00:00"),
(149,"fr",101,7,26,0,"Ouest France 14 février 2014","-fr-149","","","Ouest France 14 février 2014","Ouest France 14/02/2014","Ouest France 14/02/2014","",102,1,1,0,1,"2014-02-14 11:58:01","2015-04-17 15:44:40","0000-00-00 00:00:00"),
(154,"fr",5,1,26,0,"Communiqués de presse","communiques-de-presse","","","Communiqués de presse","Communiqués de presse","Communiqués de presse","",1,1,0,0,1,"2014-02-14 15:44:57","2015-06-19 09:38:43","0000-00-00 00:00:00"),
(155,"fr",154,1,4,0,"Table ronde organisée par le Gouvernement le 14 février 2014","table-ronde-organisee-par-le-gouvernement-le-14-fevrier-2014","","","Table ronde organisée par le Gouvernement le 14 février 2014","Evénement","Evénement \"Faire de la France le pays pionnier du financement participatif\"","",8,1,1,0,1,"2014-02-14 16:49:49","2015-03-16 16:58:40","0000-00-00 00:00:00"),
(156,"fr",154,1,4,0,"727 Sailbags emprunte auprès du grand public","727-sailbags-emprunte-aupres-du-grand-public","","","727 Sailbags emprunte auprès du grand public","727 Sailbags","727 Sailbags","",9,1,1,0,1,"2014-02-14 17:56:25","2015-03-16 17:11:51","0000-00-00 00:00:00"),
(157,"fr",154,1,4,0,"CP lancement d\'Unilend","cp-lancement-unilend","","","CP lancement d\'Unilend","Lancement du site Internet Unilend","CP lancement d\'Unilend","",10,1,1,0,1,"2014-02-14 18:06:27","2015-03-16 17:08:42","0000-00-00 00:00:00"),
(158,"fr",101,7,26,0,"BFM Académie 21 février 2014","bfm-academie-210214","","","BFM Académie 21 février 2014","BFM Académie 21/02/14","BFM Académie \"Ils aident les entrepreneurs\" Nicolas Lesur d\'Unilend interrogé par Nicolas Doze et Eve Chegaray le 21/02/14","BFM Académie \"Ils aident les entrepreneurs\" Nicolas Lesur Unilend Nicolas Doze Eve Chegaray 21/02/14",100,1,1,0,1,"2014-02-21 20:56:45","2015-04-17 15:43:08","0000-00-00 00:00:00"),
(159,"fr",1,15,1,0,"Unilend et Votre Argent","votreargent","","","Unilend et Votre Argent","Unilend et Votre Argent","Unilend et Votre Argent","",12,1,0,0,1,"2014-02-24 12:02:31","2014-02-24 17:28:00","0000-00-00 00:00:00"),
(160,"fr",101,7,26,0,"Perspectives entrepreneurs 3 mars 2014","perspectives-entrepreneurs-03032014","","","Perspectives entrepreneurs 3 mars 2014","Perspectives entrepreneurs 1/02/2014","Perspectives entrepreneurs 1/02/2014","",99,0,0,1,0,"2014-03-03 09:54:44","2015-07-22 11:31:37","0000-00-00 00:00:00"),
(161,"fr",54,1,4,0,"","-fr-161","","","","","","",1,0,0,0,1,"2014-03-13 11:01:50","2014-03-13 11:01:50","0000-00-00 00:00:00"),
(162,"fr",1,7,4,0,"Articles","articles","","","Articles","Page Image","Page Image","",11,1,0,0,0,"2014-03-14 14:02:26","2014-07-04 14:45:53","0000-00-00 00:00:00"),
(164,"fr",162,1,4,0,"Image","-fr-164","","","Image","Image","Image","",2,1,1,0,1,"2014-03-17 10:18:44","2014-05-21 14:46:04","0000-00-00 00:00:00"),
(165,"fr",101,7,26,0,"Itespresso 18 février 2014","itespresso-18022014","","","Itespresso 18 février 2014","Itespresso 18/02/2014","Itespresso 18/02/2014","itespresso.fr, financement participatif, tables rondes crowdfunding",101,1,1,0,1,"2014-03-19 18:58:34","2015-04-17 15:44:06","0000-00-00 00:00:00"),
(166,"fr",101,7,26,0,"01net.com 8 janvier 2014","-fr-166","","","01net.com 8 janvier 2014","01net.com","01net.com ","01net., crowdfunding, finance participative, dirigeant pme",105,1,1,0,1,"2014-03-19 19:10:04","2015-04-17 15:46:47","0000-00-00 00:00:00"),
(167,"fr",101,7,26,0,"JDN 26 mars 2014","jdn-26032014","","","JDN 26 mars 2014","JDN 26/03/2014","JDN 26/03/2014","",98,1,1,0,1,"2014-03-26 17:07:45","2015-04-17 15:42:02","0000-00-00 00:00:00"),
(168,"fr",154,1,4,0,"Unilend réalise sa deuxième levée de fonds","unilend-realise-sa-deuxieme-levee-de-fonds","","","Unilend réalise sa deuxième levée de fonds","Unilend, la plateforme de crowdfunding de prêt aux PME, réalise sa deuxième levée de fonds","Unilend, la plateforme de crowdfunding de prêt aux PME, réalise sa deuxième levée de fonds","",7,1,1,0,1,"2014-03-27 16:41:48","2015-03-16 16:58:29","0000-00-00 00:00:00"),
(169,"fr",101,7,26,0,"Usine Digitale 29 mars 2014","usine-digitale-29032014","","","Usine Digitale 29 mars 2014","Usine Digitale 29/03/2014","Usine Digitale 29/03/2014","",97,1,1,0,1,"2014-03-31 13:38:40","2015-04-17 15:41:34","0000-00-00 00:00:00"),
(170,"fr",162,1,4,0,"vidéo","video","","","vidéo","vidéo","vidéo","",3,1,0,1,1,"2014-04-02 18:38:49","2014-04-02 18:40:36","0000-00-00 00:00:00"),
(171,"fr",101,7,26,0,"Option Finance 18 avril 2014","option-finance","option-finance.png","","Option Finance 18 avril 2014","Option Finance","Option Finance","",96,1,1,0,1,"2014-04-18 18:18:36","2015-04-17 15:41:07","0000-00-00 00:00:00"),
(172,"fr",101,7,26,0,"Le Revenu 18 avril 2014","le-revenu","","","Le Revenu 18 avril 2014","Le Revenu","Le Revenu","",95,0,0,1,0,"2014-04-18 18:19:25","2015-07-22 11:31:40","0000-00-00 00:00:00"),
(173,"fr",172,1,26,0,"Article Le Revenu 18 avril 2014","article-le-revenu","","","Article Le Revenu 18 avril 2014","Article Le Revenu","Article Le Revenu","",21,0,0,1,0,"2014-04-18 18:32:10","2015-07-22 11:49:17","0000-00-00 00:00:00"),
(174,"fr",160,1,26,0,"Article Perspectives Entrepreneurs 3 mars 2014","article-perspectives-entrepreneurs","","","Article Perspectives Entrepreneurs 3 mars 2014","Article Perspectives Entrepreneurs","Article Perspectives Entrepreneurs","",22,0,0,1,0,"2014-04-25 19:20:35","2015-07-22 11:49:22","0000-00-00 00:00:00"),
(175,"fr",101,7,26,0,"Agefi Hebdo 1er mais 2014","agefi-hebdo","","","Agefi Hebdo 1er mai 2014","Agefi Hebdo","Agefi Hebdo","",94,0,0,1,0,"2014-05-02 15:35:29","2015-07-22 11:31:47","0000-00-00 00:00:00"),
(176,"fr",175,1,26,0,"Article Agefi Hebdo 1er mai 2014","article-agefi-hebdo","","","Article Agefi Hebdo 1er mai 2014","Article Agefi Hebdo","Article Agefi Hebdo","decouvrez-unilend-en-images-fr-10",23,0,0,1,0,"2014-05-02 16:01:09","2015-07-22 11:49:14","0000-00-00 00:00:00"),
(177,"fr",162,1,4,0,"","-fr-177","","","","","","",24,1,1,0,1,"2014-05-02 16:05:08","2014-05-02 16:05:08","0000-00-00 00:00:00"),
(178,"fr",179,1,26,0,"Article Le Figaro Eco 17 mai 2014","le-figaro-eco-170514","","","Article Le Figaro Eco 17 mai 2014","Le Figaro Eco 17/05/14","Le Figaro Eco 17/05/14","",4,0,0,1,0,"2014-05-23 20:33:35","2015-07-22 11:49:08","0000-00-00 00:00:00"),
(179,"fr",101,7,26,0,"Le Figaro Eco 17 mail 2014","le-figaro-eco-170514-fr-179","","","Le Figaro Eco 17 mai 2014","Le Figaro Eco 17/05/14","Le Figaro Eco 17/05/14","",93,0,0,1,0,"2014-05-23 20:36:56","2015-07-22 11:31:55","0000-00-00 00:00:00"),
(180,"fr",162,1,4,0,"Le Particulier","le-particulier","","","Le Particulier","Le Particulier","Le Particulier","",25,1,1,0,1,"2014-05-30 19:08:10","2014-05-30 19:39:05","0000-00-00 00:00:00"),
(181,"fr",101,7,26,0,"Le Nouvel Economiste 5 juin 2014","le-nouvel-economiste-fr-181","","","Le Nouvel Economiste 5 juin 2014","Le Nouvel Economiste","Le Nouvel Economiste","",91,1,1,0,1,"2014-05-30 19:20:19","2015-04-17 15:38:12","0000-00-00 00:00:00"),
(182,"fr",162,1,4,0,"Le Nouvel Economiste","le-nouvel","","","Le NOuvel","Le NOuvel","Le NOuvel","",26,0,0,0,1,"2014-06-06 15:08:34","2014-06-06 15:08:48","0000-00-00 00:00:00"),
(183,"fr",101,7,26,0,"Le Particulier 1er juin 2014","le-particulier-fr-183","","","Le Particulier 1er juin 2014","Le Particulier","Le Particulier 05/06/2014","",92,1,1,0,1,"2014-06-06 15:12:10","2015-04-17 15:38:38","0000-00-00 00:00:00"),
(185,"fr",101,7,26,0,"Les Echos Entrepreneurs 11 juin 2014","les-echos-entrepreneurs","","","Les Echos Entrepreneurs 11 juin 2014","Les Echos Entrepreneurs","Les Echos Entrepreneurs","",90,0,0,1,0,"2014-06-13 20:22:48","2015-07-22 11:32:00","0000-00-00 00:00:00"),
(186,"fr",185,1,26,0,"Article Les Echos Entrepreneurs 11 juin 2014","les-echo-entrepreneurs","","","Article Les Echos Entrepreneurs 11 juin 2014","Les Echos Entrepreneurs","Les Echos Entrepreneurs","",27,0,0,1,0,"2014-06-13 20:33:00","2015-07-22 11:49:02","0000-00-00 00:00:00"),
(188,"fr",10,2,3,0,"Nos clients parlent de nous","nos-clients-parlent-de-nous","","","Nos clients parlent de nous","Nos clients parlent de nous","Nos clients parlent de nous","",9,1,1,0,1,"2014-06-27 11:41:49","2014-09-15 09:50:19","0000-00-00 00:00:00"),
(192,"fr",188,7,26,0,"727 Sailbags témoignage","727-sailbags-temoignage-fr-192","","","727 Sailbags","727 Sailbags témoignage","727 Sailbags témoignage ","",8,1,1,0,1,"2014-06-27 14:57:00","2015-04-21 11:49:29","0000-00-00 00:00:00"),
(193,"fr",10,1,4,0,"Test HTML","-fr-193","","","Test HTML","Test HTML","Test HTML","",14,0,0,1,1,"2014-07-02 11:51:05","2014-07-30 20:06:05","0000-00-00 00:00:00"),
(194,"fr",162,1,4,0,"Val de Marne Info","val-de-marne-info","","","Val de Marne Info","Val de Marne Info","Val de Marne Info","",28,1,0,0,1,"2014-07-04 14:43:17","2014-07-04 15:14:54","0000-00-00 00:00:00"),
(195,"fr",1,17,4,0,"Tout le monde peut prêter aux entreprises","tout-le-monde-peut-preter-aux-entreprises","","","Tout le monde peut prêter aux entreprises","Landing page","Landing page","",13,1,0,0,1,"2014-07-10 15:03:14","2015-04-17 10:01:49","0000-00-00 00:00:00"),
(196,"fr",195,16,4,0,"Pret aux PME","pret-pme","","","Pretez aux PME","Pret aux PME","Prêtez directement votre argent aux entreprises et PME françaises et recevez des intérêts\r\n","pret pme entreprise ",0,1,0,0,1,"2014-07-10 15:04:41","2015-07-22 15:55:16","0000-00-00 00:00:00"),
(197,"fr",195,16,4,0,"Prêtez aux entreprises","pret-entreprises","","","Prêtez aux entreprises","Pret-aux-entreprises","Prêtez directement votre argent aux entreprises et PME françaises et recevez des intérêts\r\n","pret pme entreprise ",1,1,1,0,1,"2014-07-10 17:20:50","2015-07-22 15:54:42","0000-00-00 00:00:00"),
(198,"fr",10,1,4,0,"Test HTML2","test-html2","","","Test HTML2","Test HTML2","Test HTML2","",15,0,0,1,1,"2014-07-30 18:56:48","2014-09-08 18:47:49","0000-00-00 00:00:00"),
(199,"fr",7,7,3,0,"Christophe Martins","christophe-martins","","","Christophe Martins","Christophe Martins","Christophe Martins","",15,1,1,0,1,"2014-08-19 17:35:29","2015-04-20 12:38:58","0000-00-00 00:00:00"),
(200,"fr",7,7,4,0,"Emmanuel Perez-Duarte","-fr-200","","","Emmanuel Perez-Duarte","Emmanuel Perez-Duarte","Emmanuel Perez-Duarte","",17,1,1,0,1,"2014-08-19 17:47:18","2015-04-17 19:11:11","0000-00-00 00:00:00"),
(201,"fr",7,7,4,0,"Pierre-Henri Soler","pierre-henri-soler","","","Pierre-Henri Soler","Pierre-Henri Soler","Pierre-Henri Soler","",13,1,1,0,1,"2014-08-19 17:49:53","2014-09-02 15:10:40","0000-00-00 00:00:00"),
(202,"fr",7,7,3,0,"Nicolas Hesse","nicolas-hesse","","","Nicolas Hesse","Nicolas Hesse","Nicolas Hesse","",18,0,0,1,1,"2014-08-19 17:52:29","2014-10-23 16:22:12","0000-00-00 00:00:00"),
(203,"fr",7,7,4,0,"Thierry Garot","-fr-203","","","Thierry Garot","Thierry Garot","Thierry Garot","",14,1,1,0,1,"2014-08-19 17:54:22","2014-09-02 15:10:59","0000-00-00 00:00:00"),
(204,"fr",195,16,1,0,"Empruntez auprès du grand public","decouvrez-unilend-fr-204","","","Découvrez le prêt aux entreprises","Découvrez le prêt aux entreprises","Découvrez le prêt aux entreprises","",4,0,0,0,1,"2014-08-22 14:29:12","2014-10-13 14:27:57","0000-00-00 00:00:00"),
(205,"fr",7,7,3,0,"Le comité d\'orientation","le-comite-dorientation","","","Le Comité d\'orientation","Comité d\'orientation","Le comité d\'orientation","",6,1,1,0,1,"2014-08-25 18:37:23","2015-04-20 12:43:38","0000-00-00 00:00:00"),
(207,"fr",188,7,26,0,"Des nouvelles d\'Or Normes","ornormes-vous-remercie-fr-207","","","Or\'Normes","Or\'Normes vous remercie","Or\'Normes vous remercie","",7,1,1,0,1,"2014-08-29 10:31:32","2015-04-21 11:48:58","0000-00-00 00:00:00"),
(208,"fr",207,1,26,0,"Message Or\'Normes","message-ornormes","","","Message Or\'Normes","Message Or\'Normes","Message Or\'Normes","",1,1,1,0,1,"2014-09-02 11:45:51","2015-04-21 12:02:11","0000-00-00 00:00:00"),
(210,"fr",192,1,26,0,"Message 727 Sailbags","message-727-sailbags","","","Message 727 Sailbags","Message 727 Sailbags","Message 727 Sailbags","",1,1,1,0,1,"2014-09-02 11:55:22","2015-04-21 12:02:49","0000-00-00 00:00:00"),
(211,"fr",101,7,26,0,"Sud Ouest 31 août 2014","sud-ouest-31082014","","","Sud Ouest 31 août 2014","Sud Ouest 31/08/2014","Sud Ouest 31/08/2014","",89,0,0,1,0,"2014-09-05 18:35:15","2015-07-22 11:32:07","0000-00-00 00:00:00"),
(212,"fr",211,1,26,0,"Article Sud Ouest le 31 août 2014","sud-ouest-le-31082014","","","Article Sud Ouest le 31 août 2014","Sud Ouest le 31/08/2014","Sud Ouest le 31/08/2014","",1,0,0,1,0,"2014-09-05 18:50:29","2015-07-22 11:48:58","0000-00-00 00:00:00"),
(213,"fr",188,7,26,0,"Evertrans","-fr-213","","","Evertrans","Evertrans","Evertrans","",10,1,1,0,1,"2014-09-12 15:49:08","2015-04-21 11:50:43","0000-00-00 00:00:00"),
(214,"fr",101,7,26,0,"Challenges 29 janvier 2015","challenges-29012015","","","Challenges 29 janvier 2015","Challenges 29/01/2015","Challenges 29/01/2015","",45,0,0,1,0,"2014-09-18 18:23:14","2015-07-22 11:35:01","0000-00-00 00:00:00"),
(215,"fr",101,7,26,0,"Chef d\'entreprise 29 septembre 2014","-fr-215","","","Chef d\'entreprise 29 septembre 2014","Chef d\'entreprise","Chef d\'entreprise","",86,1,1,0,1,"2014-10-02 14:01:39","2015-04-17 15:35:28","0000-00-00 00:00:00"),
(216,"fr",101,7,26,0,"Libération 28 septembre 2014","liberation-28092014","","","Libération 28 septembre 2014","Libération 29/09/2014","Libération 29/09/2014","",87,1,1,0,1,"2014-10-02 14:36:07","2015-04-17 15:35:57","0000-00-00 00:00:00"),
(218,"fr",101,7,26,0,"mediapart 26 septembre 2014","mediapart-26092014-fr-218","","","Mediapart 26 septembre 2014","mediapart 26/09/2014","mediapart 26/09/2014","",88,1,1,0,1,"2014-10-02 14:51:12","2015-04-17 15:36:26","0000-00-00 00:00:00"),
(219,"fr",101,7,26,0,"Clubic 2 octobre 2014","clubic-02102014","","","Clubic 2 octobre 2014","Clubic 02/10/2014","Clubic 02/10/2014","",84,1,1,0,1,"2014-10-02 15:20:28","2015-04-17 15:34:06","0000-00-00 00:00:00"),
(220,"fr",154,1,4,0,"Groupama Banque s’engage aux côtés d\'Unilend","groupama-banque-sengage-aux-cotes-dunilend","","","Groupama Banque s’engage aux côtés d\'Unilend","Groupama Banque s’engage aux côtés d\'Unilend","Groupama Banque s’engage aux côtés d\'Unilend","",3,1,1,0,1,"2014-10-03 11:20:06","2015-03-16 17:12:46","0000-00-00 00:00:00"),
(221,"fr",154,1,4,0,"Financement de l’innovation : le crowdfunding s’invite chez les technopoles","financement-de-linnovation-le-crowdfunding-sinvite-chez-les-technopoles","","","Financement de l’innovation : le crowdfunding s’invite chez les technopoles","Financement de l’innovation : le crowdfunding s’invite chez les technopoles","Financement de l’innovation : le crowdfunding s’invite chez les technopoles","",6,1,1,0,1,"2014-10-03 11:20:43","2015-03-16 16:57:14","0000-00-00 00:00:00"),
(222,"fr",10,1,4,0,"Comment emprunter auprès du grand public","comment-emprunter-aupres-du-grand-public","","","Comment emprunter auprès du grand public","Comment emprunter auprès du grand public","Comment emprunter auprès du grand public","",13,1,0,0,1,"2014-10-07 13:59:00","2014-11-14 11:13:16","0000-00-00 00:00:00"),
(223,"fr",188,7,26,0,"Seaways","seaways","","","Seaways","Seaways","Seaways","",4,1,1,0,1,"2014-10-07 16:38:58","2015-04-21 11:45:59","0000-00-00 00:00:00"),
(224,"fr",223,1,26,0,"Message Seaways","message-seaways","","","Message Seaways","Message Seaways","Message Seaways","",1,1,1,0,1,"2014-10-07 16:43:06","2015-04-21 11:59:59","0000-00-00 00:00:00"),
(225,"fr",188,7,18,0,"Vision du Ciel","vision-du-ciel","","","Vision du Ciel","Vision du Ciel","Vision du Ciel","",6,0,0,1,1,"2014-10-07 17:10:29","2015-06-17 17:38:46","0000-00-00 00:00:00"),
(226,"fr",225,1,26,0,"Message Vision du Ciel","message-vision-du-ciel","","","Message Vision du Ciel","Message Vision du Ciel","Message Vision du Ciel","",1,0,1,0,1,"2014-10-07 17:13:30","2015-06-17 17:38:46","0000-00-00 00:00:00"),
(227,"fr",213,1,26,0,"Message Evertrans","message-evertrans","","","Message Evertrans","Message Evertrans","Message Evertrans","",1,1,1,0,1,"2014-10-07 18:21:06","2015-04-21 12:03:29","0000-00-00 00:00:00"),
(228,"fr",188,7,26,0,"Vignobles Laville","vignobles-laville","","","Vignobles Laville","Les Vignobles Laville","Les Vignobles Laville","",11,1,1,0,1,"2014-10-07 18:39:57","2015-04-21 11:51:18","0000-00-00 00:00:00"),
(229,"fr",228,1,26,0,"Message Vignobles Laville","message-vignobles-laville","","","Message Vignobles Laville","Message Vignobles Laville","Message Vignobles Laville","",1,1,1,0,1,"2014-10-07 18:48:56","2015-04-21 12:04:11","0000-00-00 00:00:00"),
(230,"fr",188,7,26,0,"Bewiz","bewiz","","","Bewiz","Bewiz","Bewiz","",5,1,1,0,1,"2014-10-07 18:57:46","2015-04-21 11:47:58","0000-00-00 00:00:00"),
(231,"fr",230,1,4,0,"Message Bewiz","message-bewiz-fr-231","","","Message Bewiz","Message Bewiz","Message Bewiz","",1,1,1,0,1,"2014-10-07 19:09:45","2014-10-07 19:21:20","0000-00-00 00:00:00"),
(232,"fr",188,7,26,0,"Boubat Bâtiment","boubat-batiment","","","Boubat Bâtiment","Boubat","Boubat","",9,1,1,0,1,"2014-10-07 19:25:33","2015-04-21 11:50:15","0000-00-00 00:00:00"),
(233,"fr",232,1,26,0,"Message Boubat Bâtiment","message-boubat-batiment","","","Message Boubat Bâtiment","Message Entreprise Boubat","Message Entreprise Boubat","",1,1,1,0,1,"2014-10-07 19:28:39","2015-04-21 12:03:00","0000-00-00 00:00:00"),
(234,"fr",101,7,26,0,"Le Point 9 octobre 2014","le-point-09102014","","","Le Point 9 octobre 2014","Le Point 09/10/2014","Le Point 09/10/2014","",83,0,0,1,0,"2014-10-09 10:58:58","2015-07-22 11:32:30","0000-00-00 00:00:00"),
(235,"fr",234,1,26,0,"Article Le Point 9 octobre 2014","article-le-point-09102014","","","Article Le Point 9 octobre 2014","Article Le Point 09/102014/","Article Le Point 09/102014/","",1,0,0,1,0,"2014-10-09 11:11:27","2015-07-22 11:48:38","0000-00-00 00:00:00"),
(236,"fr",195,17,4,0,"Dépôt de dossier","lp-depot-de-dossier","","","Dépôt de dossier","Dépôt de dossier","Dépôt de dossier","",3,1,0,0,0,"2014-10-13 11:36:55","2015-07-22 15:25:13","0000-00-00 00:00:00"),
(237,"fr",1,1,26,0,"Challenge partenaires","challenge-partenaires","","","Challenge partenaires","Challenge partenaires","Challenge partenaires","",14,1,0,0,0,"2014-10-13 18:32:04","2015-07-15 15:29:45","0000-00-00 00:00:00"),
(238,"fr",101,7,26,0,"Le Monde 13 octobre 2014","-fr-238","","","Le Monde 13 octobre 2014","Le Monde 13/10/2014","Le Monde 13/10/2014","",81,1,1,0,1,"2014-10-14 09:23:31","2015-04-17 15:32:45","0000-00-00 00:00:00"),
(239,"fr",101,7,26,0,"La Provence 13 octobre 2014","la-provence-13102014","","","La Provence 13 octobre 2014","La Provence 13/10/2014","La Provence 13/10/2014","",82,1,1,0,1,"2014-10-14 09:55:49","2015-04-17 15:33:12","0000-00-00 00:00:00"),
(240,"fr",101,7,26,0,"Nouvel Obs 16 octobre 2014","nouvel-obs-16102014","","","Nouvel Obs 16 octobre 2014","Nouvel Obs 16/10/2014","Nouvel Obs 16/10/2014","",79,0,0,1,0,"2014-10-16 11:26:41","2015-07-22 11:32:38","0000-00-00 00:00:00"),
(241,"fr",240,1,26,0,"Article Nouvel Obs 16 octobre 2014","article-nouvel-obs-16102014","","","Article Nouvel Obs 16 octobre 2014","Article Nouvel Obs 16/10/2014","Article Nouvel Obs 16/10/2014","",1,0,0,1,0,"2014-10-16 11:36:02","2015-07-22 11:48:32","0000-00-00 00:00:00"),
(242,"fr",101,7,26,0,"Les Echos judiciaires Girondins 14 octobre 2014","les-echos-judiciaires-girondins-14102014","","","Les Echos judiciaires Girondins 14 octobre 2014","Les Echos judiciaires Girondins 14/10/2014","Les Echos judiciaires Girondins 14/10/2014","",80,0,0,1,0,"2014-10-16 11:59:49","2015-07-22 14:27:17","0000-00-00 00:00:00"),
(243,"fr",101,7,26,0,"La Tribune 17 octobre 2014","la-tribune-17102014","","","La Tribune 17 octobre 2014","La Tribune 17/10/2014","La Tribune 17/10/2014","",78,0,0,1,0,"2014-10-17 16:47:16","2015-07-22 11:32:49","0000-00-00 00:00:00"),
(244,"fr",243,1,26,0,"Article La Tribune 17 octobre 2014","article-la-tribune-17102014","","","Article La Tribune 17 octobre 2014","Article La Tribune 17/10/2014","Article La Tribune 17/10/2014","",1,0,0,1,0,"2014-10-17 17:32:17","2015-07-22 11:48:27","0000-00-00 00:00:00"),
(245,"fr",195,17,4,0,"Financement participatif : PME, empruntez auprès du grand public","financement-participatif-pme-empruntez-aupres-du-grand-public","","","Financement participatif : PME, empruntez auprès du grand public","Financement participatif : PME, empruntez auprès du grand public","Financement participatif : PME, empruntez auprès du grand public","",2,1,1,0,1,"2014-10-20 11:28:54","2015-07-22 15:35:25","0000-00-00 00:00:00"),
(246,"fr",101,7,26,0,"Capital Finance 20 octobre 2014","-fr-246","","","Capital Finance 20 octobre 2014","Capital Finance 20/10/2014","Capital Finance 20/10/2014","",77,1,1,0,1,"2014-10-20 18:07:10","2015-04-17 14:30:03","0000-00-00 00:00:00"),
(247,"fr",101,7,26,0,"Le journal des entreprises 22 octobre 2014","le-journal-des-entreprises-22102014","","","Le journal des entreprises 22 octobre 2014","Le journal des entreprises 22/10/2014","Le journal des entreprises 22/10/2014","",75,1,1,0,1,"2014-10-23 12:06:03","2015-04-17 14:29:08","0000-00-00 00:00:00"),
(248,"fr",101,7,26,0,"NetPme 20 octobre 2014","netpme-20102014","","","NetPme 20 octobre 2014","NetPme 20/10/2014","NetPme 20/10/2014","",76,1,1,0,1,"2014-10-23 14:49:51","2015-04-17 14:29:40","0000-00-00 00:00:00"),
(249,"fr",101,7,26,0,"Capital Mensuel Octobre 2014","capital-mensuel-octobre-2014","","","Capital Mensuel Octobre 2014","Capital Mensuel Octobre 2014","Capital Mensuel Octobre 2014","",85,0,0,1,0,"2014-10-24 10:45:35","2015-07-22 11:32:23","0000-00-00 00:00:00"),
(250,"fr",249,1,26,0,"Article Capital Mensuel Octobre 2014","capital-mensuel-octobre-2014-article","","","Article Capital Mensuel Octobre 2014","Capital Mensuel Octobre 2014 article","Capital Mensuel Octobre 2014 article","",1,0,0,1,0,"2014-10-24 10:55:50","2015-07-22 11:48:44","0000-00-00 00:00:00"),
(251,"fr",101,7,26,0,"Ouest France 24 octobre 2014","ouest-france-24102014","","","Ouest France 24 octobre 2014","Ouest France 24/10/2014","Ouest France 24/10/2014","",74,0,0,1,0,"2014-10-24 12:10:43","2015-07-22 11:32:55","0000-00-00 00:00:00"),
(252,"fr",154,1,4,0,"Sauver l’entreprise de textile bretonne Dolmen","sauver-lentreprise-de-textile-bretonne-dolmen","","","Sauver l’entreprise de textile bretonne Dolmen","La plateforme de crowdfunding Unilend aide à réunir 200 000 euros pour sauver l’entreprise de textile bretonne Dolmen","La plateforme de crowdfunding Unilend aide à réunir 200 000 euros pour sauver l’entreprise de textile bretonne Dolmen","",5,1,1,0,1,"2014-10-24 14:14:58","2015-03-16 16:57:02","0000-00-00 00:00:00"),
(253,"fr",251,1,26,0,"Article Ouest France 24 octobre 2014","ouest-france-24102014-article","","","Article Ouest France 24 octobre 2014","Ouest France 24/10/2014 article","Ouest France 24/10/2014 article","",1,0,0,1,0,"2014-10-24 14:44:34","2015-07-22 11:48:20","0000-00-00 00:00:00"),
(254,"fr",89,9,27,0,"Conditions générales de vente prêteurs","cgu-preteur-2","","","Conditions générales de vente prêteurs V2 28-10-2014","Conditions générales de vente prêteur","Conditions générales de vente prêteur","Conditions générales de vente prêteurs, cgv prêteurs, informations prêt, SFFPME, responsabilités",2,0,0,0,1,"2014-10-28 09:32:21","2015-07-10 19:36:44","0000-00-00 00:00:00"),
(255,"fr",94,9,13,0,"Conditions générales de vente bénéficiaire","cgv-2-depot-de-dossier","","","CGV bénéficiaire 28/10/2014","Conditions générales de vente bénéficiaire","Conditions générales de vente bénéficiaire","conditions générales de vente bénéficiaires, cgv bénéficiaires",2,1,1,0,1,"2014-10-28 10:35:19","2015-06-09 15:31:48","0000-00-00 00:00:00"),
(256,"fr",101,7,26,0,"Les Echos Bourse 5 novembre 2014","les-echos-bourse-05112014","","","Les Echos Bourse 5 novembre 2014","Les Echos Bourse 05/11/2014","Les Echos Bourse 05/11/2014","",69,0,0,1,0,"2014-10-31 10:16:42","2015-07-22 14:27:34","0000-00-00 00:00:00"),
(258,"fr",7,7,4,0,"Arnaud Schwartz","arnaud-schwartz","","","Arnaud Schwartz","Arnaud Schwartz","Arnaud Schwartz","",11,1,1,0,1,"2014-11-03 09:13:12","2014-11-03 09:40:41","0000-00-00 00:00:00"),
(259,"fr",10,1,4,0,"Comment prêter à des entreprises de toute la France","comment-preter-a-des-entreprises-de-toute-la-france","","","Comment prêter à des entreprises de toute la France","Comment emprunter auprès du grand public","Comment emprunter auprès du grand public","",11,1,0,0,1,"2014-11-04 16:20:51","2014-11-14 11:17:31","0000-00-00 00:00:00"),
(260,"fr",101,7,26,0,"Electroniques 4 novembre 2014","electroniques-04112014","","","Electroniques 4 novembre 2014","Electroniques 04/11/2014","Electroniques 04/11/2014","",71,1,1,0,1,"2014-11-04 18:32:51","2015-04-17 14:26:04","0000-00-00 00:00:00"),
(261,"fr",10,1,4,0,"Mail prêteurs Jolie Doll","mail-preteurs-jolie-doll","","","Mail prêteurs Jolie Doll","Mail prêteurs Jolie Doll","Mail prêteurs Jolie Doll","",16,0,0,1,1,"2014-11-05 10:14:46","2014-11-05 10:51:00","0000-00-00 00:00:00"),
(262,"fr",101,7,26,0,"Les Echos Bourse 5 novembre 2014","les-echos-bourse-05112014-fr-262","","","Les Echos Bourse 5 novembre 2014","Les Echos Bourse 05/11/2014","Les Echos Bourse 05/11/2014","",70,0,0,1,0,"2014-11-06 12:52:31","2015-07-22 14:27:27","0000-00-00 00:00:00"),
(263,"fr",101,7,26,0,"Figaro Magazine 07 novembre 2014","figaro-magazine-07112014","","","Figaro Magazine 07 novembre 2014","Figaro Magazine 07/11/2014","Figaro Magazine 07/11/2014","",68,1,1,0,1,"2014-11-07 15:37:06","2015-04-17 14:22:52","0000-00-00 00:00:00"),
(264,"fr",101,7,26,0,"Affiches Parisiennes 3 novembre 2014","affiches-parisiennes-03112014","","","Affiches Parisiennes 3 novembre 2014","Affiches Parisiennes 03/11/2014","Affiches Parisiennes 03/11/2014","",72,1,1,0,1,"2014-11-07 15:51:21","2015-04-17 14:26:40","0000-00-00 00:00:00"),
(265,"fr",101,7,26,0,"Les Echos partenaires 13 novembre 2014","les-echos-partenaires-13112014","","","Les Echos partenaires 13 novembre 2014","Les Echos partenaires 13/11/2014","Les Echos partenaires 13/11/2014","",67,0,0,1,0,"2014-11-13 11:15:34","2015-07-22 11:33:13","0000-00-00 00:00:00"),
(266,"fr",265,1,26,0,"Article Les Echos Partenaires 13 novembre 2014","article-les-echos-partenaires-13112014","","","Article Les Echos Partenaires 13 novembre 2014","Article Les Echos Partenaires 13/11/2013","Article Les Echos Partenaires 13/11/2013","",1,0,0,1,0,"2014-11-13 11:27:56","2015-07-22 11:48:09","0000-00-00 00:00:00"),
(267,"fr",101,7,26,0,"Finances & Conseil Méditerranée 19 novembre 2014","finances-conseil-mediterranee","","","Finances & Conseil Méditerranée 19 novembre 2014","Finances & Conseil Méditerranée","Finances & Conseil Méditerranée ","",66,1,1,0,1,"2014-11-19 16:22:36","2015-04-17 14:21:50","0000-00-00 00:00:00"),
(268,"fr",101,7,26,0,"Mieux Vivre Votre Argent décembre 2014","mieux-vivre-votre-argent-decembre-2014","","","Mieux Vivre Votre Argent décembre 2014","Mieux Vivre Votre Argent décembre 2014","Mieux Vivre Votre Argent décembre 2014","",63,0,0,1,0,"2014-11-20 14:46:04","2015-07-22 11:34:38","0000-00-00 00:00:00"),
(269,"fr",268,1,26,0,"Article Mieux Vivre Votre Argent  décembre 2014","article-mieux-vivre-votre-argent-decembre-2014","","","Article Mieux Vivre Votre Argent  décembre 2014","Article Mieux Vivre Votre Argent  décembre 2014","Article Mieux Vivre Votre Argent  décembre 2014","",1,0,0,1,0,"2014-11-20 14:47:49","2015-07-22 11:46:22","0000-00-00 00:00:00"),
(270,"fr",195,17,4,0,"Emprunter auprès du grand public avec Empruntis","emprunter-aupres-du-grand-public","","","Emprunter auprès du grand public avec Empruntis","Emprunter auprès du grand public avec Empruntis","Emprunter auprès du grand public avec Empruntis","",5,1,1,0,1,"2014-11-21 15:04:00","2015-07-22 15:27:09","0000-00-00 00:00:00"),
(271,"fr",101,7,26,0,"Le Revenu 21 novembre 2014","le-revenu-21112014","","","Le Revenu 21 novembre 2014","Le Revenu 21/11/2014","Le Revenu 21/11/2014","",65,0,0,1,0,"2014-11-21 18:24:41","2015-07-22 11:33:19","0000-00-00 00:00:00"),
(272,"fr",271,1,26,0,"Article Le Revenu 21 novembre 2014","article-le-revenu-21112014","","","Article Le Revenu 21 novembre 2014","Article Le Revenu 21/11/2014","Article Le Revenu 21/11/2014","",1,0,0,1,0,"2014-11-21 18:41:35","2015-07-22 11:46:33","0000-00-00 00:00:00"),
(273,"fr",101,7,26,0,"Challenges 21 novembre 2014","challenges-21112014","","","Challenges 21 novembre 2014","Challenges 21/11/2014","Challenges 21/11/2014","",64,0,0,1,0,"2014-11-26 10:12:22","2015-07-22 11:33:25","0000-00-00 00:00:00"),
(274,"fr",273,1,26,0,"Article Challenges 21 novembre 2014","article-challenges-21112014","","","Article Challenges 21 novembre 2014","Article Challenges 21/11/2014","Article Challenges 21/11/2014","",1,0,0,1,0,"2014-11-26 10:23:56","2015-07-22 11:46:28","0000-00-00 00:00:00"),
(275,"fr",101,7,26,0,"cBanque 01 décembre 2014","cbanque-01122014","","","cBanque 01 décembre 2014","cBanque 02/12/2014","cBanque 02/12/2014","",61,1,1,0,1,"2014-12-02 09:43:55","2015-04-17 12:46:25","0000-00-00 00:00:00"),
(276,"fr",101,7,26,0,"Banques des Professionnels 1er novembre 2014","banques-des-professionnels-01112014","","","Banques des Professionnels 1er novembre 2014","Banques des Professionnels","Banques des Professionnels ","",73,0,0,1,0,"2014-12-05 14:28:24","2015-07-22 11:33:01","0000-00-00 00:00:00"),
(277,"fr",276,1,26,0,"Article Banques des Professionnels 1er novembre 2014","article-banques-des-professionnels-01112014","","","Article Banques des Professionnels 1er novembre 2014","Article Banques des Professionnels 01/11/2014","Article Banques des Professionnels 01/11/2014","",1,0,0,1,0,"2014-12-05 14:35:21","2015-07-22 11:48:14","0000-00-00 00:00:00"),
(278,"fr",154,1,4,0,"Unilend, le leader français du crowdfunding de prêt aux TPE/PME, fête son premier anniversaire","unilend-fete-son-premier-anniversaire","","","Unilend fête son premier anniversaire","Unilend, le leader français du crowdfunding de prêt aux TPE/PME, fête son premier anniversaire","Unilend, le leader français du crowdfunding de prêt aux TPE/PME, fête son premier anniversaire","",4,1,1,0,1,"2014-12-09 09:55:44","2015-03-16 16:56:54","0000-00-00 00:00:00"),
(279,"fr",101,7,26,0,"cBanque 08 décembre 2014","cbanque-08122014","","","cBanque 08 décembre 2014","cBanque 08/12/2014","cBanque 08/12/2014","",60,1,1,0,1,"2014-12-09 10:54:55","2015-04-17 12:46:01","0000-00-00 00:00:00"),
(280,"fr",101,7,26,0,"Good Morning Crowdfunding 08 décembre 2014","good-morning-crowdfunding-08122014","","","Good Morning Crowdfunding 08 décembre 2014","Good Morning Crowdfunding 09/12/2014","Good Morning Crowdfunding 09/12/2014","",59,1,1,0,1,"2014-12-09 17:23:55","2015-04-17 12:45:36","0000-00-00 00:00:00"),
(281,"fr",1,1,26,0,"Infographie un an d\'Unilend","infographie-un-an-unilend","","","Infographie un an d\'Unilend","Infographie un an d\'Unilend","Infographie un an Unilend","",15,1,0,0,1,"2014-12-11 13:54:17","2015-05-04 18:01:34","0000-00-00 00:00:00"),
(282,"fr",195,18,4,0,"Les entreprises empruntent auprès du grand public","entreprise","","","Les entreprises empruntent auprès du grand public","Les entreprises empruntent auprès du grand public","Les entreprises empruntent auprès du grand public","",6,1,0,0,1,"2014-12-12 12:14:08","2015-07-22 15:29:38","0000-00-00 00:00:00"),
(283,"fr",101,7,26,0,"Le Monde 10 décembre 2014","le-monde-10122014","","","Le Monde 10 décembre 2014","Le Monde 10/12/2014","Le Monde 10/12/2014","",58,1,1,0,1,"2014-12-12 15:23:45","2015-04-17 15:54:07","0000-00-00 00:00:00"),
(284,"fr",101,7,26,0,"Blue Awards 15 decembre2014","blue-awards-15122014","1419009695-la-tribune.jpg","","Blue Awards 15 décembre 2014","Blue Awards 15/12/2014","Blue Awards 15/12/2014","",57,1,1,0,1,"2014-12-19 18:10:57","2015-04-17 12:41:43","0000-00-00 00:00:00"),
(285,"fr",101,7,26,0,"Capital janvier 2015","capital-janvier-2014","","","Capital janvier 2015","Capital janvier 2014","Capital janvier 2014","",56,0,0,1,0,"2014-12-24 13:59:14","2015-07-22 11:34:44","0000-00-00 00:00:00"),
(286,"fr",285,1,26,0,"Article Capital 1er janvier 2015","article-capital-01012015","","","Article Capital 1er janvier 2015","Article Capital 01/01/2015","Article Capital 01/01/2015","",0,0,0,1,0,"2014-12-24 14:19:35","2015-07-22 11:46:10","0000-00-00 00:00:00"),
(291,"fr",101,7,26,0,"Le Particulier janvier 2015","le-particulier-janvier-2015","","","Le Particulier janvier 2015","Le Particulier janvier 2015","Le Particulier janvier 2015","",55,0,0,1,0,"2014-12-24 15:41:42","2015-07-22 11:34:50","0000-00-00 00:00:00"),
(292,"fr",291,1,26,0,"Article Le Particulier janvier 2015","article-le-particulier-janv-2015","","","Article Le Particulier janvier 2015","Article Le Particulier janv 2015","Article Le Particulier janv 2015","",1,0,0,1,0,"2014-12-24 15:45:58","2015-07-22 11:46:05","0000-00-00 00:00:00"),
(293,"fr",101,7,26,0,"Mieux Vivre Votre Argent janvier 2015","mieux-vivre-votre-argent-janvier-2015","","","Mieux Vivre Votre Argent janvier 2015","Mieux Vivre Votre Argent janvier 2015","Mieux Vivre Votre Argent janvier 2015","",54,1,1,0,1,"2014-12-26 16:57:17","2015-04-17 12:08:45","0000-00-00 00:00:00"),
(294,"fr",10,3,13,0,"Statistiques","statistiques","","","Statistiques","Statistiques Unilend","Statistiques","",7,1,1,0,1,"2014-12-31 18:01:32","2015-07-02 09:40:54","0000-00-00 00:00:00"),
(295,"fr",101,7,26,0,"Funds Magazine 01 décembre 2014","funds-magazine-01122014","","","Funds Magazine 01 décembre 2014","Funds Magazine 01/12/2014","Funds Magazine 01/12/2014","",62,0,0,1,0,"2015-01-08 18:48:34","2015-07-22 11:34:37","0000-00-00 00:00:00"),
(296,"fr",295,1,26,0,"Article Funds Magazine 1er décembre 2014","article-funds-magazine-01122014","","","Article Funds Magazine 1er décembre 2014","Article Funds Magazine 01/122014","Article Funds Magazine 01/122014","",1,0,0,1,0,"2015-01-08 18:55:16","2015-07-22 11:46:16","0000-00-00 00:00:00"),
(297,"fr",162,1,4,0,"Article Marseille Innovation 05/11/2014","article-marseille-innovation-05112014","","","Article Marseille Innovation 05/11/2014","Article Marseille Innovation 05/11/2014","Article Marseille Innovation 05/11/2014","",63,1,1,0,1,"2015-01-08 19:07:27","2015-01-09 19:25:28","0000-00-00 00:00:00"),
(298,"fr",162,1,4,0,"Article La lettre de CCI","article-la-lettre-de-cci","","","Article La lettre de CCI","Article La lettre de CCI","Article La lettre de CCI","",64,1,1,0,1,"2015-01-09 09:54:13","2015-01-09 09:55:20","0000-00-00 00:00:00"),
(299,"fr",101,7,26,0,"Good Morning Crowdfunding 7 janvier 2015","good-morning-crowdfunding-07012015","","","Good Morning Crowdfunding 7 janvier 2015","Good Morning Crowdfunding 07/01/2015","Good Morning Crowdfunding 07/01/2015","",52,1,1,0,1,"2015-01-09 15:18:29","2015-04-17 12:07:27","0000-00-00 00:00:00"),
(300,"fr",101,7,26,0,"Crowdfund Insideer 6 janvier 2015","crowdfund-insideer-06012015","","","Crowdfund Insideer 6 janvier 2015","Crowdfund Insideer 06/01/2015","Crowdfund Insideer 06/01/2015","",53,1,1,0,1,"2015-01-09 15:46:56","2015-04-17 12:08:23","0000-00-00 00:00:00"),
(301,"fr",89,9,27,0,"Conditions générales de vente prêteurs","conditions-generales-de-vente-preteurs","","","Conditions générales de vente prêteurs","Conditions générales de vente prêteurs","Conditions générales de vente prêteurs V3-22/01/2015","",3,1,1,0,1,"2015-01-14 10:55:38","2015-07-10 19:37:26","0000-00-00 00:00:00"),
(302,"fr",101,7,26,0,"Le Figaro 10 janvier 2015","le-figaro-100115","","","Le Figaro 10 janvier 2015","Le Figaro 15/01/15","Le Figaro 15/01/15","",51,1,1,0,1,"2015-01-15 21:07:28","2015-04-17 12:06:51","0000-00-00 00:00:00"),
(303,"fr",101,7,26,0,"L\'AGEFI actifs 21 janvier 2015","lagefi-actifs-21012015","","","L\'AGEFI actifs 21 janvier 2015","L\'AGEFI actifs 21/01/2015","L\'AGEFI actifs 21/01/2015","",47,1,1,0,1,"2015-01-27 09:43:45","2015-04-17 12:01:26","0000-00-00 00:00:00"),
(304,"fr",101,7,26,0,"Les Echos 21 janvier 2015","les-echos-21012015","","","Les Echos 21 janvier 2015","Les Echos 27/01/2015","Les Echos 27/01/2015","",49,0,0,1,0,"2015-01-27 09:59:11","2015-07-22 14:25:33","0000-00-00 00:00:00"),
(305,"fr",101,7,26,0,"Le Figaro 21 janvier 2015","le-figaro-210115-fr-305","","","Le Figaro 21 janvier 2015","Le Figaro 21/01/15","Le Figaro 21/01/15","",48,1,1,0,1,"2015-01-27 10:05:31","2015-04-17 12:02:39","0000-00-00 00:00:00"),
(306,"fr",101,7,26,0,"Le Monde 21 janvier 2015","le-monde-21012015","","","Le Monde 21 janvier 2015","Le Monde 21/01/2015","Le Monde 21/01/2015","",50,1,1,0,1,"2015-01-27 12:09:53","2015-04-17 12:06:24","0000-00-00 00:00:00"),
(307,"fr",195,17,4,0,"Emprunter auprès du grand public avec Meilleur Taux","financement-participatif-pme","","","Emprunter auprès du grand public avec Meilleur Taux","Emprunter auprès du grand public avec Meilleur Taux","Emprunter auprès du grand public avec Meilleur Taux","",7,1,0,0,1,"2015-01-29 10:54:53","2015-07-22 15:31:20","0000-00-00 00:00:00"),
(308,"fr",101,7,26,0,"Le Particulier mars 2015","le-particulier-mars-2015","","","Le Particulier mars 2015","Le Particulier mars 2015","Le Particulier mars 2015","",31,0,0,1,0,"2015-01-29 18:33:09","2015-07-22 11:36:51","0000-00-00 00:00:00"),
(309,"fr",214,1,26,0,"Challenges article 29 janvier 2015","challenges-article-29012015","","","Challenges article 29 janvier 2015","Challenges article 29/01/2015","Challenges article 29/01/2015","",1,0,0,1,0,"2015-01-29 18:33:24","2015-07-22 11:45:54","0000-00-00 00:00:00"),
(310,"fr",101,7,26,0,"L\'AGEFI Hebdo 29 janvier 2015","lagefi-hebdo-29012015","","","L\'AGEFI Hebdo 29 janvier 2015","L\'AGEFI Hebdo 29/01/2015","L\'AGEFI Hebdo 29/01/2015","",46,0,0,1,0,"2015-01-29 18:51:40","2015-07-22 11:34:54","0000-00-00 00:00:00"),
(311,"fr",310,1,26,0,"L\'AGEFI Hebdo article 29 janvier 2015","lagefi-hebdo-article-29012015","","","L\'AGEFI Hebdo article 29 janvier 2015","L\'AGEFI Hebdo article 29/01/2015","L\'AGEFI Hebdo article 29/01/2015","",0,0,0,1,0,"2015-01-29 18:52:14","2015-07-22 11:46:00","0000-00-00 00:00:00"),
(312,"fr",101,7,26,0,"Le Monde 02/02/2015","le-monde-02022015","","","Le Monde 02/02/2015","Le Monde 02/02/2015","Le Monde 02/02/2015","",41,1,1,0,1,"2015-02-04 12:10:49","2015-04-17 11:56:10","0000-00-00 00:00:00"),
(313,"fr",101,7,26,0,"Capital 4 février 2015","capital-04022015","","","Capital 4 février 2015","Capital 04/02/2015","Capital 04/02/2015","",39,1,1,0,1,"2015-02-04 12:29:22","2015-04-17 11:54:35","0000-00-00 00:00:00"),
(314,"fr",101,7,26,0,"Score Advisor 2 février 2015","score-advisor-02022015","","","Score Advisor 2 février 2015","Score Advisor 02/02/2015","Score Advisor 02/02/2015","",42,1,1,0,1,"2015-02-04 12:39:26","2015-04-17 11:56:44","0000-00-00 00:00:00"),
(315,"fr",101,7,26,0,"Les Echos 5 février 2015","les-echos-05022015","","","Les Echos 5 février 2015","Les Echos 06/02/2015","Les Echos 06/02/2015","",38,0,0,1,0,"2015-02-06 11:13:52","2015-07-22 11:35:28","0000-00-00 00:00:00"),
(316,"fr",315,1,26,0,"Article Les Echos 5 février 2015","article-les-echos-05022015","","","Article Les Echos 5 février 2015","Article Les Echos 05/02/2015","Article Les Echos 05/02/2015","",1,0,0,1,0,"2015-02-06 11:31:54","2015-07-22 11:44:03","0000-00-00 00:00:00"),
(317,"fr",101,7,26,0,"La Tribune 5 février 2015","la-tribune-05022015","","","La Tribune 5 février 2015","La Tribune 05/02/2015","La Tribune 05/02/2015","",37,0,0,1,0,"2015-02-06 11:45:27","2015-07-22 11:35:33","0000-00-00 00:00:00"),
(318,"fr",317,1,26,0,"Article La Tribune 5 février 2015","article-la-tribune-05022015","","","Article La Tribune 5 février 2015","Article La Tribune 05/02/2015","Article La Tribune 05/02/2015","",1,0,0,1,0,"2015-02-06 11:49:43","2015-07-22 11:43:59","0000-00-00 00:00:00"),
(319,"fr",101,7,26,0,"Le journal des entreprises 6 février 2015","le-journal-des-entreprises-06022015","","","Le journal des entreprises 6 février 2015","Article Le journal des entreprises 06/02/2015","Article Le journal des entreprises 06/02/2015","",36,0,0,1,0,"2015-02-06 11:58:33","2015-07-22 11:35:41","0000-00-00 00:00:00"),
(320,"fr",319,1,26,0,"Article Le journal des entreprises 6 février 2015","article-le-journal-des-entreprises-06022015-fr-320","","","Article Le journal des entreprises 6 février 2015","Article Le journal des entreprises 06/02/2015","Article Le journal des entreprises 06/02/2015","",1,0,0,1,0,"2015-02-06 12:07:30","2015-07-22 11:43:48","0000-00-00 00:00:00"),
(321,"fr",101,7,26,0,"Commerce magazine 1er février 2015","commerce-magazine-01022015","","","Commerce magazine 1er février 2015","Commerce magazine 06/02/2015","Commerce magazine 06/02/2015","",43,0,0,1,0,"2015-02-06 15:13:58","2015-07-22 11:35:19","0000-00-00 00:00:00"),
(322,"fr",321,1,26,0,"Article Commerce magazine 1er février 2015","article-commerce-magazine-01022015","","","Article Commerce magazine 1er février 2015","Article Commerce magazine 06/02/2015","Article Commerce magazine 06/02/2015","",1,0,0,1,0,"2015-02-06 15:23:12","2015-07-22 11:45:40","0000-00-00 00:00:00"),
(323,"fr",101,7,26,0,"Repères mars 2015","reperes-24-mars-2015","repa-res.png","","Repères mars 2015","Repère mars 2015","Repère mars 2015","",28,0,0,1,0,"2015-02-12 19:11:43","2015-07-22 11:37:10","0000-00-00 00:00:00"),
(324,"fr",323,1,26,0,"Article Repères 24 mars 2015","article-reperes-24-mars-2015","","","Article Repères 24 mars 2015","Article Repères 24 mars 2015","Article Repères 24 mars 2015","",1,0,0,1,0,"2015-02-12 19:24:02","2015-07-22 11:42:51","0000-00-00 00:00:00"),
(325,"fr",101,7,26,0,"La Tribune 12 février 2015","la-tribune-12022015","","","La Tribune 12 février 2015","La Tribune 12/02/2015","La Tribune 12/02/2015","",35,0,0,1,0,"2015-02-12 19:39:12","2015-07-22 11:35:48","0000-00-00 00:00:00"),
(326,"fr",325,1,26,0,"Article La Tribune 12/02/2015","article-la-tribune-12022015","","","Article La Tribune 12/02/2015","Article La Tribune 12/02/2015","Article La Tribune 12/02/2015","",1,0,0,1,0,"2015-02-12 19:43:13","2015-07-22 11:43:41","0000-00-00 00:00:00"),
(327,"fr",101,7,26,0,"Finance pratique 2 février 2015","finance-pratique-02022015","","","Finance pratique 2 février 2015","Finance pratique 02/02/2015","Finance pratique 02/02/2015","",40,1,1,0,1,"2015-02-13 10:10:44","2015-04-17 11:55:50","0000-00-00 00:00:00"),
(328,"fr",101,7,26,0,"Agefi Quotidien 13 février 2015","agefi-quotidien-13022014","","","Agefi Quotidien 13 février 2015","Agefi Quotidien 13/02/2014","Agefi Quotidien 13/02/2014","",34,0,0,1,0,"2015-02-13 14:10:57","2015-07-22 11:35:57","0000-00-00 00:00:00"),
(329,"fr",328,1,26,0,"Article L\'AGEFi Quotidien 13 février 2015","article-lagefi-quotidien-13022015","","","Article L\'AGEFi Quotidien 13 février 2015","Article L\'AGEFi Quotidien 13/02/2015","Article L\'AGEFi Quotidien 13/02/2015 ","",1,0,0,1,0,"2015-02-13 14:22:52","2015-07-22 11:43:31","0000-00-00 00:00:00"),
(330,"fr",101,7,26,0,"L\'echo du patrimoine janvier 2015","l-echo-du-patrimoine-janvier-2015","","","L\'echo du patrimoine janvier 2015","L\'echo du patrimoine janvier 2015","L\'echo du patrimoine janvier 2015","",44,0,0,1,0,"2015-02-13 15:18:51","2015-07-22 11:35:15","0000-00-00 00:00:00"),
(331,"fr",330,1,26,0,"Article L\'echo du patrimoine janvier 2015","article-l-echo-du-patrimoine-janvier-2015","","","Article L\'echo du patrimoine janvier 2015","Article L\'echo du patrimoine janvier 2015","Article L\'echo du patrimoine janvier 2015","",1,0,0,1,0,"2015-02-13 15:23:32","2015-07-22 11:45:51","0000-00-00 00:00:00"),
(332,"fr",195,16,4,0,"Prêtez aux PME - Votre Argent","votre-argent","","","Prêtez aux PME - Votre Argent","Prêtez aux PME - Votre Argent","Prêtez aux PME - Votre Argent","",8,1,1,0,1,"2015-02-16 18:16:17","2015-07-22 15:41:19","0000-00-00 00:00:00"),
(333,"fr",195,17,4,0,"Financement participatif : L\'Entreprise","financement-participatif-lentreprise","","","Financement participatif : L\'Entreprise","Financement participatif : L\'Entreprise","Financement participatif : L\'Entreprise","",9,1,1,0,1,"2015-02-16 18:20:59","2015-07-22 15:42:21","0000-00-00 00:00:00"),
(334,"fr",91,1,26,0,"Comment répartir ses prêts","comment-repartir-ses-prets","","","Comment répartir ses prêts","Comment répartir ses prêts","Comment répartir ses prêts","",2,1,1,0,1,"2015-02-19 14:44:02","2015-06-19 11:14:44","0000-00-00 00:00:00"),
(335,"fr",308,1,26,0,"Article Le Particulier mars 2015","article-le-particulier-mars-2015","","","Article Le Particulier mars 2015","Article Le Particulier mars 2015","Article Le Particulier mars 2015","",1,0,0,1,0,"2015-02-19 20:35:33","2015-07-22 11:43:12","0000-00-00 00:00:00"),
(336,"fr",101,7,26,0,"Votre Argent 20 février 2015","votre-argent-20-fevrier-2015","","","Votre Argent 20 février 2015","Votre Argent 20 février 2015","Votre Argent 20 février 2015","",33,0,0,1,0,"2015-02-20 17:12:15","2015-07-22 11:36:02","0000-00-00 00:00:00"),
(337,"fr",336,0,4,0,"","-fr-337","","","","","","",1,0,1,0,1,"2015-02-23 11:59:02","2015-07-22 11:36:02","0000-00-00 00:00:00"),
(338,"fr",101,7,26,0,"Valeurs Actuelles 26 février 2015","valeurs-actuelles-26022015","","","Valeurs Actuelles 26 février 2015","Valeurs Actuelles 26/02/2015","Valeurs Actuelles 26/02/2015","",32,0,0,1,0,"2015-02-26 18:41:35","2015-07-22 11:36:43","0000-00-00 00:00:00"),
(339,"fr",338,1,26,0,"Articles Valeurs Actuelles 26 février 2015","articles-valeurs-actuelles-26022015","","","Articles Valeurs Actuelles 26 février 2015","Articles Valeurs Actuelles 26 février 2015","Articles Valeurs Actuelles 26 février 2015","",1,0,0,1,0,"2015-02-26 18:42:26","2015-07-22 11:43:21","0000-00-00 00:00:00"),
(340,"fr",101,7,26,0,"Agefi Hebo mars 2015","agefi-hebo-mars-2015","","","Agefi Hebo mars 2015","Agefi Hebo mars 2015","Agefi Hebo mars 2015","",29,0,0,1,0,"2015-03-05 19:18:55","2015-07-22 11:37:00","0000-00-00 00:00:00"),
(341,"fr",340,1,26,0,"Article Agefi Hebdo mars 2015","article-agefihebdo-mars-2015","","","Article Agefi hebdo mars 2015","Article Agefi Hebdo mars 2015","Article Agefi  Hebdo mars 2015","",1,0,0,1,0,"2015-03-05 19:19:55","2015-07-22 11:42:58","0000-00-00 00:00:00"),
(342,"fr",101,7,26,0,"Paris Match mars 2015","paris-match-mars-2015","","","Paris Match mars 2015","Paris Match mars 2015","Paris Match mars 2015","",30,0,0,1,0,"2015-03-05 19:26:32","2015-07-22 11:36:55","0000-00-00 00:00:00"),
(343,"fr",342,1,26,0,"Article Paris Match mars 2015","article-paris-match-mars-2015","","","Article Paris Match mars 2015","Article Paris Match mars 2015","Article Paris Match mars 2015","",0,0,0,1,0,"2015-03-05 19:27:01","2015-07-22 11:43:06","0000-00-00 00:00:00"),
(344,"fr",195,17,4,0,"Emprunter auprès du grand public avec CAFPI","emprunter-avec-cafpi","","","Emprunter auprès du grand public avec CAFPI","Emprunter auprès du grand public avec CAFPI","Emprunter auprès du grand public avec CAFPI","",10,1,1,0,1,"2015-03-06 18:27:17","2015-07-22 15:42:57","0000-00-00 00:00:00"),
(345,"fr",101,7,26,0,"Banques des entreprises 11 mars 2015","banques-des-entreprises-11-mars-2015","","","Banques des entreprises 11 mars 2015","Banques des entreprises 11 mars 2015","Banques des entreprises 11 mars 2015","",27,0,0,1,0,"2015-03-12 18:32:13","2015-07-22 11:38:11","0000-00-00 00:00:00"),
(346,"fr",345,1,26,0,"Articles Banques des entreprises 11 mars 2015","articles-banques-des-entreprises-11-mars-2015","","","Articles Banques des entreprises 11 mars 2015","Articles Banques des entreprises 11 mars 2015","Articles Banques des entreprises 11 mars 2015","",1,0,0,1,0,"2015-03-12 18:32:55","2015-07-22 11:42:43","0000-00-00 00:00:00"),
(347,"fr",154,1,3,0,"Unilend réalise une levée de fonds de 8 millions d\'euros","unilend-realise-une-levee-de-fonds-de-8-millions-deuros","","","Unilend réalise une levée de fonds de 8 millions d\'euros","Le leader français du crowdlending Unilend réalise une levée de fonds de 8 millions d\'euros","Le leader français du crowdlending Unilend réalise une levée de fonds de 8 millions d\'euros","",2,1,1,0,1,"2015-03-16 16:40:30","2015-03-16 20:14:29","0000-00-00 00:00:00"),
(348,"fr",101,7,26,0,"Le Revenu 21 mars 2015","le-revenu-21-mars-2015","","","Le Revenu 21 mars 2015","Le Revenu 21 mars 2015","Le Revenu 21 mars 2015","",26,1,1,0,1,"2015-03-20 19:01:22","2015-07-23 09:48:24","0000-00-00 00:00:00"),
(349,"fr",195,17,4,0,"Emprunter auprès du grand public avec Vousfinancer.com","emprunter-avec-vous-financer","","","Emprunter avec Vousfinancer.com","Emprunter auprès du grand public avec Vousfinancer.com","Emprunter auprès du grand public avec Vousfinancer.com","",11,1,1,0,1,"2015-03-23 17:45:25","2015-07-22 15:44:19","0000-00-00 00:00:00"),
(350,"fr",195,17,4,0,"Emprunter auprès du grand public avec Agora Finance","emprunter-avec-agora-finance","","","Empruntez avec Agora Finance","Empruntez auprès du grand public avec Agora Finance","Empruntez auprès du grand public avec Agora Finance","",12,1,1,0,1,"2015-03-25 18:27:58","2015-07-22 15:48:07","0000-00-00 00:00:00"),
(351,"fr",101,7,26,0,"Aujourd\'hui en France 27 mars 2015","aujourdhui-en-france-27-mars-2015","","","Aujourd\'hui en France 27 mars 2015","Aujourd\'hui en France 27 mars 2015","Aujourd\'hui en France 27 mars 2015","",24,0,0,1,0,"2015-03-27 16:50:35","2015-07-22 11:38:17","0000-00-00 00:00:00"),
(352,"fr",351,1,26,0,"Article Aujourd\'hui en France 27 mars 2015","article-aujourdhui-en-france-27-mars-2015","","","Article Aujourd\'hui en France 27 mars 2015","Article Aujourd\'hui en France 27 mars 2015","Article Aujourd\'hui en France 27 mars 2015","",1,0,0,1,0,"2015-03-27 16:56:19","2015-07-22 11:42:38","0000-00-00 00:00:00"),
(353,"fr",101,7,26,0,"Le Revenu 26 mars 2015","le-revenu-26-mars-2015","","","Le Revenu 26 mars 2015","Le Revenu 26 mars 2015","Le Revenu 26 mars 2015","",25,1,1,0,1,"2015-03-27 17:38:34","2015-07-23 09:50:20","0000-00-00 00:00:00"),
(354,"fr",101,7,26,0,"cBanque 31 mars 2015","cbanque-31mars2015","","","cBanque 31 mars 2015","cBanque 31/03/2015","cBanque 31/03/2015","",23,1,1,0,1,"2015-04-01 11:02:51","2015-07-23 09:50:54","0000-00-00 00:00:00"),
(355,"fr",188,7,26,0,"Studio Pack","studio-pack","1428064904-studiopackheader.jpg","","Studio Pack","Studio Pack","Studio Pack","",3,1,1,0,1,"2015-04-03 15:20:52","2015-06-10 10:14:41","0000-00-00 00:00:00"),
(356,"fr",355,1,26,0,"Message Studio Pack","message-studiopack","","","Message Studio Pack","Message Studiopack","Message Studiopack","",1,1,1,0,1,"2015-04-03 15:21:48","2015-06-08 17:46:55","0000-00-00 00:00:00"),
(357,"fr",1,19,4,0,"L\'express","lexpress-fr-357","","","L\'express - L\'entreprise","test lexpress","test lexpress","",16,1,0,0,1,"2015-04-08 14:05:14","2015-06-08 16:16:57","0000-00-00 00:00:00"),
(358,"fr",1,19,4,0,"L\'express - L\'entreprise","test-lexpress-entreprise","","","L\'express - L\'entreprise","L\'express - L\'entreprise","L\'express - L\'entreprise","",17,1,0,0,1,"2015-04-09 11:33:17","2015-06-08 16:15:17","0000-00-00 00:00:00"),
(359,"fr",188,7,26,0,"Pascal et Béatrix","pascal-et-beatrix","","","Pascal et Béatrix","Pascal et Béatrix","Pascal et Béatrix","",0,1,1,0,1,"2015-04-09 11:48:24","2015-06-10 10:13:58","0000-00-00 00:00:00"),
(360,"fr",188,7,26,0,"727 Sailbags","727-sailbags","1428586801-1403873827-727-sailbags-boutique-en-ligne-sacs-en-toiles-de-voiles-de-bateaux-recycla-es.png","","727 Sailbags","Sailbag727","Sailbag727","",2,1,1,0,1,"2015-04-09 14:47:12","2015-06-10 10:14:30","0000-00-00 00:00:00"),
(361,"fr",360,1,26,0,"Message 727 Sailbags","message-727-sailbags2","","","Message 727 Sailbags","Message 727 Sailbags","Message 727 Sailbags","",1,1,1,1,1,"2015-04-09 14:48:24","2015-06-08 17:45:42","0000-00-00 00:00:00"),
(362,"fr",188,7,26,0,"SBL Provence","sbl-provence","ludivine-mazet-sbl-provence.jpg","","SBL Provence","SBL Provence","SBL Provence","",1,1,1,0,1,"2015-04-09 15:54:17","2015-06-10 10:14:15","0000-00-00 00:00:00"),
(363,"fr",362,1,26,0,"Message SBL Provence","message-sbl-provence","","","Message SBL Provence","Message SBL Provence","Message SBL Provence","",1,0,1,0,1,"2015-04-09 15:56:05","2015-06-08 17:47:31","0000-00-00 00:00:00"),
(364,"fr",101,7,26,0,"Option Finance 13 avril 2015","option-finance-le-13-avril-2015","option-finance.jpg","","Option Finance 13 avril 2015","Option Finance le 13 avril 2015","Option Finance le 13 avril 2015","",22,0,0,1,0,"2015-04-16 11:47:43","2015-07-22 11:38:24","0000-00-00 00:00:00"),
(365,"fr",364,1,26,0,"Article Option Finance 13 avril 2015","article-option-finance-le-13-avril-2015","","","Article Option Finance 13 avril 2015","Article Option Finance le 13 avril 2015","Article Option Finance le 13 avril 2015","",1,0,0,1,0,"2015-04-16 11:55:51","2015-07-22 11:42:37","0000-00-00 00:00:00"),
(366,"fr",101,7,26,0,"Le Monde 16 avril 2015","le-monde-16-avril-2015","img-contenu2-1423055400-logo-le-monde.png","","Le Monde 16 avril 2015","Le Monde 16 avril 2015","Le Monde 16 avril 2015","",21,1,1,0,1,"2015-04-17 09:35:06","2015-07-23 09:51:26","0000-00-00 00:00:00"),
(367,"fr",101,7,26,0,"Libération 17 avril 2015","liberation-17-avril-2015","img-contenu2-logo-liberation.png","","Libération 17 avril 2015","Libération 17 avril 2015","Libération 17 avril 2015","",20,0,0,1,0,"2015-04-17 16:00:44","2015-07-22 11:38:32","0000-00-00 00:00:00"),
(368,"fr",367,1,26,0,"Article Libération 17 avril 2015","article-liberation-17-avril-2015","","","Article Libération 17 avril 2015","Article Libération 17 avril 2015","Article Libération 17 avril 2015","",1,0,0,1,0,"2015-04-17 16:16:15","2015-07-22 11:42:29","0000-00-00 00:00:00"),
(369,"fr",7,7,4,0,"Le comité stratégique","le-comite-strategique","","","Le comité stratégique","Le comité stratégique","Le comité stratégique","",0,1,1,0,1,"2015-04-17 18:37:50","2015-04-17 19:23:01","0000-00-00 00:00:00"),
(370,"fr",7,7,26,0,"Xavier Deleplace","xavier-deleplace","","","Xavier Deleplace","Xavier Deleplace","Xavier Deleplace","",3,1,1,0,1,"2015-04-17 18:43:51","2015-04-30 11:00:04","0000-00-00 00:00:00"),
(371,"fr",7,7,3,0,"Emanuele Levi","emanuele-levi","","","Emanuele Levi","Emanuele Levi","Emanuele Levi","",5,1,1,0,1,"2015-04-17 18:51:18","2015-04-20 12:38:06","0000-00-00 00:00:00"),
(372,"fr",7,7,3,0,"Jean Bourcereau","jean-bourcereau","","","Jean Bourcereau","Jean Bourcereau","Jean Bourcereau","",4,1,1,0,1,"2015-04-17 19:06:10","2015-04-20 12:39:29","0000-00-00 00:00:00"),
(373,"fr",7,7,4,0,"L\'équipe","lequipe","","","L\'équipe","L\'équipe","L\'équipe","",10,1,1,0,1,"2015-04-17 19:18:40","2015-04-17 20:25:57","0000-00-00 00:00:00"),
(374,"fr",7,7,3,0,"Bpi Investissement","bpi-investissement","","","Bpi Investissement","Bpi Investissement","Bpi Investissement","",27,1,1,0,1,"2015-04-17 19:29:43","2015-05-13 15:34:04","0000-00-00 00:00:00"),
(375,"fr",7,7,3,0,"360 Capital Partners","360-capital-partners","","","360 Capital Partners","360 Capital Partners","360 Capital Partners","",29,1,1,0,1,"2015-04-17 19:45:30","2015-05-13 15:34:17","0000-00-00 00:00:00"),
(376,"fr",7,7,3,0,"Ventech","ventech","","","Ventech","Ventech","Ventech","",28,1,1,0,1,"2015-04-17 19:53:44","2015-05-13 15:34:10","0000-00-00 00:00:00"),
(377,"fr",7,7,4,0,"Ils nous conseillent","ils-nous-conseillent","","","Ils nous conseillent","Ils nous conseillent","Ils nous conseillent","",19,1,1,0,1,"2015-04-17 20:25:30","2015-04-17 20:26:10","0000-00-00 00:00:00"),
(379,"fr",195,17,4,0,"Empruntez avec AunisEco","aunis","","","Empruntez avec AunisEco","Empruntez avec AunisEco","Empruntez avec AunisEco","",13,1,1,0,1,"2015-04-23 15:48:57","2015-07-22 15:46:46","0000-00-00 00:00:00"),
(380,"fr",1,20,4,0,"Express","express","","","Express","express","express","",18,1,0,0,1,"2015-04-23 17:54:19","2015-06-08 16:14:13","0000-00-00 00:00:00"),
(381,"fr",5,1,26,0,"Données personnelles & Cookies","donnees-personnelles-cookies","","","Données personnelles & Cookies","Données personnelles & Cookies","Données personnelles & Cookies","",19,1,0,0,1,"2015-04-24 12:44:57","2015-06-19 11:12:59","0000-00-00 00:00:00"),
(383,"fr",101,7,26,0,"Les Echos 24 avril 2015","les-echos-24-avril-2015-fr-383","1429892763-img-contenu2-1423218496-les-echos.png","","Les Echos 24 avril 2015","Les Echos 24 avril 2015","Les Echos 24 avril 2015","",18,0,0,1,0,"2015-04-24 15:06:28","2015-07-22 11:38:38","0000-00-00 00:00:00"),
(384,"fr",383,1,26,0,"Article Les Echos 24 avril 2015","article-les-echos-24-avril-2015","","","Article Les Echos 24 avril 2015","Article Les Echos 24 avril 2015","Article Les Echos 24 avril 2015","",1,0,0,1,0,"2015-04-24 15:09:13","2015-07-22 11:42:18","0000-00-00 00:00:00"),
(385,"fr",101,7,26,0,"Business & Marchés 20 avril 2015","business-marches-20-avril-2015","business-er-marches-contenu-2.JPG","","Business & Marchés 20 avril 2015","Business & Marchés 20 avril 2015","Business & Marchés 20 avril 2015","",19,1,1,0,1,"2015-04-27 09:30:32","2015-07-23 09:51:56","0000-00-00 00:00:00"),
(386,"fr",101,7,26,0,"Le Parisien 27 avril 2015","le-parisien-27-avril-2015","sous-contenu-2-le-parisien.jpg","","Le Parisien 27 avril 2015","Le Parisien 27 avril 2015","Le Parisien 27 avril 2015","",17,1,1,0,1,"2015-04-28 09:56:19","2015-07-23 09:52:20","0000-00-00 00:00:00"),
(387,"fr",101,7,26,0,"L\'AGEFI quotidien 30 avril 2015","lagefi-quotidien-30-avril-2015","1430383321-l-agefi-quotidien.png","","L\'AGEFI quotidien 30 avril 2015","L\'AGEFI quotidien 30 avril 2015","L\'AGEFI quotidien 30 avril 2015","",16,1,1,0,1,"2015-04-30 10:42:01","2015-07-23 09:52:43","0000-00-00 00:00:00"),
(388,"fr",101,7,26,0,"Ecommercemag le 28 avril 2015","ecommercemag-le-28-avril-2015","","","Ecommercemag le 28 avril 2015","Ecommercemag le 28 avril 2015","Ecommercemag le 28 avril 2015","",15,1,1,0,1,"2015-04-30 11:43:38","2015-07-23 09:53:00","0000-00-00 00:00:00"),
(389,"fr",1,1,26,0,"Plus de dix millions d’euros empruntés","unilend-dix-millions","","","Plus de dix millions d’euros empruntés","Unilend dix millions","Unilend dix millions","",19,1,0,0,1,"2015-05-04 17:30:45","2015-05-05 14:27:43","0000-00-00 00:00:00"),
(390,"fr",101,7,26,0,"Entreprendre le 1er mai 2015","entreprendre-le-1er-mai-2015","entreprendre.jpg","","Entreprendre le 1er mai 2015","Entreprendre le 1er mai 2015","Entreprendre le 1er mai 2015","",14,0,0,1,0,"2015-05-05 15:37:07","2015-07-22 11:38:44","0000-00-00 00:00:00"),
(391,"fr",390,1,26,0,"Article Entreprendre le 1er mai 2015","article-entreprendre-le-1er-mai-2015","","","Article Entreprendre le 1er mai 2015","Article Entreprendre le 1er mai 2015","Article Entreprendre le 1er mai 2015","",1,0,0,1,0,"2015-05-05 15:38:36","2015-07-22 11:42:11","0000-00-00 00:00:00"),
(392,"fr",154,1,26,0,"Unilend franchit le cap des 10 millions d\'euros de prêts aux PME françaises","unilend-franchit-le-cap-des-10-millions-deuros-de-prets-aux-pme-francaises","","","Unilend franchit le cap des 10 millions d\'euros de prêts aux PME françaises","Unilend franchit le cap des 10 millions d\'euros de prêts aux PME françaises","Unilend franchit le cap des 10 millions d\'euros de prêts aux PME françaises","",1,1,1,0,1,"2015-05-05 16:01:34","2015-05-06 16:42:56","0000-00-00 00:00:00"),
(393,"fr",1,21,4,0,"Bienvenue","bienvenue-fr-393","","","Bienvenue","Bienvenue","Bienvenue","",20,1,0,0,1,"2015-05-06 16:15:08","2015-06-08 16:13:20","0000-00-00 00:00:00"),
(394,"fr",101,7,26,0,"Finyear le 7 mai 2015","finyear-le-7-mai-2015","finyear.jpg","","Finyear le 7 mai 2015","Finyear le 7 mai 2015","Finyear le 7 mai 2015","",13,0,1,0,1,"2015-05-07 14:50:31","2015-07-22 11:54:02","0000-00-00 00:00:00"),
(395,"fr",101,7,26,0,"Touléco le 17 mai 2015","touleco-le-17-mai-2015","toulei-co.jpg","","Touléco le 17 mai 2015","Touléco le 17 mai 2015","Touléco le 17 mai 2015","",11,1,1,0,1,"2015-05-19 15:14:40","2015-07-23 09:53:56","0000-00-00 00:00:00"),
(396,"fr",101,7,26,0,"Le Particulier le 1er juin 2015","le-particulier-le-1er-juin-2015","img-contenu2-img-contenu2-1419432260-logo-le-particulier.png","","Le Particulier le 1er juin 2015","Le Particulier le 1er juin 2015","Le Particulier le 1er juin 2015","",7,0,0,1,0,"2015-05-21 16:24:57","2015-07-22 11:38:58","0000-00-00 00:00:00"),
(397,"fr",396,1,26,0,"Article Le Particulier le 1er juin 2015","article-le-particulier-le-1er-juin-2015","","","Article Le Particulier le 1er juin 2015","Article Le Particulier le 1er juin 2015","Article Le Particulier le 1er juin 2015","",1,0,0,1,0,"2015-05-21 16:27:19","2015-07-22 11:41:54","0000-00-00 00:00:00"),
(398,"fr",101,7,26,0,"Métropole le 26 mai 2015","metropole-le-26-mai-2015","ma-tropole.jpg","","Métropole le 26 mai 2015","Métropole le 26 mai 2015","Métropole le 26 mai 2015","",12,1,1,0,1,"2015-05-26 15:03:42","2015-07-23 09:53:24","0000-00-00 00:00:00"),
(399,"fr",101,7,26,0,"Entreprendre le 26 mai 2015","entreprendre-le-26-mai-2015","","","Entreprendre le 26 mai 2015","Entreprendre le 26 mai 2015","Entreprendre le 26 mai 2015","",10,1,1,0,1,"2015-05-26 16:29:41","2015-07-23 10:00:14","0000-00-00 00:00:00"),
(400,"fr",101,7,26,0,"Le Revenu le 29 mai 2015","le-revenu-le-29-mai-2015","img-contenu2-le-revenu.png","","Le Revenu le 29 mai 2015","Le Revenu le 29 mai 2015","Le Revenu le 29 mai 2015","",9,0,0,1,0,"2015-05-29 16:21:41","2015-07-22 11:38:52","0000-00-00 00:00:00"),
(401,"fr",400,1,26,0,"Article Le Revenu le 29 mai 2015","article-le-revenu-le-29-mai-2015","","","Article Le Revenu le 29 mai 2015","Article Le Revenu le 29 mai 2015","Article Le Revenu le 29 mai 2015","",1,0,0,1,0,"2015-05-29 16:22:16","2015-07-22 11:42:04","0000-00-00 00:00:00"),
(402,"fr",101,7,26,0,"Le Parisien le 2 juin 2015","le-parisien-le-2-juin-2015","img-contenu2-1430208235-sous-contenu-2-le-parisien.jpg","","Le Parisien le 2 juin 2015","Le Parisien le 2 juin 2015","Le Parisien le 2 juin 2015","",5,1,1,0,1,"2015-06-03 10:05:54","2015-07-23 10:01:23","0000-00-00 00:00:00"),
(403,"fr",101,7,26,0,"Le journal du Grand Paris le 3 juin 2015","lejournaldugrandparis.fr-le-3-juin-2015","sans-titre.jpg","","Le journal du Grand Paris le 3 juin 2015","Lejournaldugrandparis.fr le 3 juin 2015","Lejournaldugrandparis.fr le 3 juin 2015","",4,1,1,0,1,"2015-06-03 19:14:10","2015-07-23 10:01:54","0000-00-00 00:00:00"),
(404,"fr",101,7,26,0,"Enjeux Les Echos le 1er juin 2015","enjeux-les-echos-le-1er-juin-2015","","","Enjeux Les Echos le 1er juin 2015","Enjeux Les Echos le 1er juin 2015","Enjeux Les Echos le 1er juin 2015","",6,0,0,1,0,"2015-06-04 11:20:28","2015-07-22 11:39:04","0000-00-00 00:00:00"),
(405,"fr",404,1,26,0,"Article Enjeux Les Echos le 1er juin 2015","article-enjeux-les-echos-le-1er-juin-2015","","","Article Enjeux Les Echos le 1er juin 2015","Article Enjeux Les Echos le 1er juin 2015","Article Enjeux Les Echos le 1er juin 2015","",1,0,0,1,0,"2015-06-04 11:21:39","2015-07-22 11:41:51","0000-00-00 00:00:00"),
(406,"fr",101,7,26,0,"Neuilly Journal le 29 mai 2015","neuilly-journal-le-29-mai-2015","","","Neuilly Journal le 29 mai 2015","Neuilly Journal le 29 mai 2015","Neuilly Journal le 29 mai 2015","",8,1,1,0,1,"2015-06-04 14:11:08","2015-07-23 10:00:41","0000-00-00 00:00:00"),
(407,"fr",101,7,26,0,"Le journal du grand paris le 8 juin 2015","le-journal-du-grand-paris-le-8-juin-2015","","","Le journal du grand paris le 8 juin 2015","Le journal du grand paris le 8 juin 2015","Le journal du grand paris le 8 juin 2015","",116,0,1,0,1,"2015-06-08 12:02:38","2015-06-08 12:11:09","0000-00-00 00:00:00"),
(408,"fr",407,1,26,0,"Article Le journal du Grand Paris le 8 juin 2015","article-le-journal-du-grand-paris-le-8-juin-2015","","","Article Le journal du Grand Paris le 8 juin 2015","Article Le journal du Grand Paris le 8 juin 2015","Article Le journal du Grand Paris le 8 juin 2015","",1,0,0,1,0,"2015-06-08 12:04:55","2015-07-22 11:49:46","0000-00-00 00:00:00"),
(409,"fr",10,1,26,0,"Le premier spot TV d\'Unilend","premier-spot-tv-unilend","","","Le premier spot TV d\'Unilend","Premier spot TV Unilend","Premier spot TV Unilend","",12,1,0,0,1,"2015-06-15 14:37:17","2015-06-16 11:02:37","0000-00-00 00:00:00"),
(410,"fr",101,7,26,0,"Les Echos 15 juin 2015","les-echos-15-juin-2015","1434439889-img-contenu2-1423218496-les-echos.png","","Les Echos 15 juin 2015","Les Echos 15 juin 2015","Les Echos 15 juin 2015","",3,0,0,1,0,"2015-06-16 09:31:30","2015-07-22 11:39:13","0000-00-00 00:00:00"),
(411,"fr",410,1,26,0,"Article Les Echos 15 juin 2015","article-les-echos-15-juin-2015","","","Article Les Echos 15 juin 2015","Les Echos 15 juin 2015","Les Echos 15 juin 2015","",1,0,0,1,0,"2015-06-16 09:35:57","2015-07-22 11:41:44","0000-00-00 00:00:00"),
(412,"fr",10,1,26,0,"Charte de déontologie","charte-de-deontologie","","","Charte de déontologie","Charte de déontologie d\'Unilend","Charte de déontologie d\'Unilend","",6,1,1,0,1,"2015-06-16 19:35:27","2015-06-19 09:35:23","0000-00-00 00:00:00"),
(413,"fr",154,1,4,0,"Unilend devient partenaire officiel du projet de Jean-Pierre Dick","unilend-devient-partenaire-officiel-du-projet-de-jean-pierre-dick","","","Unilend devient partenaire officiel du projet de Jean-Pierre Dick","Unilend devient partenaire officiel du projet de Jean-Pierre Dick","Unilend devient partenaire officiel du projet de Jean-Pierre Dick","",0,1,1,0,1,"2015-06-18 11:52:53","2015-06-19 19:30:48","0000-00-00 00:00:00"),
(414,"fr",101,7,26,0,"Challenges 18 juin 2015","challenges-18-juin-2015","1434644470-challenges.png","","Challenges 18 juin 2015","Challenges 18 juin 2015","Challenges 18 juin 2015","",2,0,0,1,0,"2015-06-18 18:16:20","2015-07-22 11:39:16","0000-00-00 00:00:00"),
(415,"fr",414,1,26,0,"Article Challenge 18 juin 2015","article-challenge-18-juin-2015","","","Article Challenge 18 juin 2015","Article Challenge 18 juin 2015","Article Challenge 18 juin 2015","",1,0,0,1,0,"2015-06-18 18:22:16","2015-07-22 11:40:14","0000-00-00 00:00:00"),
(416,"fr",101,7,26,0,"Rue89 Lyon le 22 juin 2015","rue89-lyon-le-22-juin-2015","","","Rue89 Lyon le 22 juin 2015","Rue89 Lyon le 22 juin 2015","Rue89 Lyon le 22 juin 2015","",1,1,1,0,1,"2015-06-23 12:15:40","2015-07-23 10:02:20","0000-00-00 00:00:00"),
(417,"fr",10,1,26,0,"Spots 15 secondes","spots-15-secondes","","","Spots 15 secondes","Spots 15 secondes","Spots 15 secondes","",17,1,0,1,1,"2015-06-26 16:03:12","2015-06-26 19:19:59","0000-00-00 00:00:00"),
(418,"fr",101,7,26,0,"Les Echos Business le 2 juillet 2015","les-echos-business-le-2-juillet-2015","les-echos-business.jpg","","Les Echos Business le 2 juillet 2015","Les Echos Business le 02 juillet 2015","Les Echos Business le 02 juillet 2015","",0,0,0,1,0,"2015-07-02 18:34:54","2015-07-22 14:31:11","0000-00-00 00:00:00"),
(419,"fr",1,1,4,0,"Challenge premier projet","challenge-premier-projet","","","Challenge premier projet","Challenge premier projet","Challenge premier projet","",21,1,0,0,0,"2015-07-10 17:48:25","2015-07-16 12:21:06","0000-00-00 00:00:00"),
(420,"fr",101,7,26,0,"La Montagne le 09 juillet 2015","la-montagne-le-09-juillet-2015","la-montagne.png","","La Montagne le 09 juillet 2015","La Montagne le 09 juillet 2015","La Montagne le 09 juillet 2015","",117,0,0,1,0,"2015-07-10 19:08:07","2015-07-22 11:31:32","0000-00-00 00:00:00"),
(421,"fr",420,1,26,0,"Article La Montagne le 09 juillet 2015","article-la-montagne-le-09-juillet-2015","","","Article La Montagne le 09 juillet 2015","Article La Montagne le 09 juillet 2015","Article La Montagne le 09 juillet 2015","",1,0,0,1,0,"2015-07-10 19:11:05","2015-07-22 11:49:54","0000-00-00 00:00:00"),
(422,"fr",101,7,26,0,"L\'Argus de l\'Assurance le 7 juillet 2015","largus-de-lassurance-le-7-juillet-2015","argus.png","","L\'Argus de l\'Assurance le 7 juillet 2015","L\'Argus de l\'Assurance le 7 juillet 2015","L\'Argus de l\'Assurance le 7 juillet 2015","",118,0,0,1,0,"2015-07-10 19:19:42","2015-07-22 11:31:31","0000-00-00 00:00:00"),
(423,"fr",422,1,26,0,"Article L\'Argus de l\'Assurance le 7 juillet 2015","article-largus-de-lassurance-le-7-juillet-2015","","","Article L\'Argus de l\'Assurance le 7 juillet 2015","Article L\'Argus de l\'Assurance le 7 juillet 2015","Article L\'Argus de l\'Assurance le 7 juillet 2015","",1,0,0,1,0,"2015-07-10 19:26:09","2015-07-22 11:49:57","0000-00-00 00:00:00");
